# name: test/sql/cte.test
# description: Test that MVs defined with CTE-based SQL (from LPTS) work correctly
# group: [sql]

require openivm

statement ok
SET openivm_cascade_refresh = 'off';

# ============================================================
# Basic: MV with aggregate (LPTS generates CTEs internally)
# ============================================================

statement ok
CREATE TABLE cte_base (grp VARCHAR, val INT);

statement ok
INSERT INTO cte_base VALUES ('a', 10), ('a', 20), ('b', 30);

statement ok
CREATE MATERIALIZED VIEW cte_agg AS SELECT grp, SUM(val) AS total FROM cte_base GROUP BY grp;

statement ok
INSERT INTO cte_base VALUES ('a', 5), ('c', 100);

statement ok
PRAGMA refresh('cte_agg');

query I
SELECT COUNT(*) FROM (
    SELECT grp, SUM(val) AS total FROM cte_base GROUP BY grp
    EXCEPT ALL
    SELECT grp, total FROM cte_agg
);
----
0

query I
SELECT COUNT(*) FROM (
    SELECT grp, total FROM cte_agg
    EXCEPT ALL
    SELECT grp, SUM(val) AS total FROM cte_base GROUP BY grp
);
----
0

# ============================================================
# Multi-table join (LPTS generates nested CTEs)
# ============================================================

statement ok
CREATE TABLE cte_users (id INT, name VARCHAR);

statement ok
CREATE TABLE cte_orders (user_id INT, amount INT);

statement ok
INSERT INTO cte_users VALUES (1, 'Alice'), (2, 'Bob');

statement ok
INSERT INTO cte_orders VALUES (1, 100), (2, 200);

statement ok
CREATE MATERIALIZED VIEW cte_joined AS
    SELECT u.name, o.amount FROM cte_users u INNER JOIN cte_orders o ON u.id = o.user_id;

statement ok
INSERT INTO cte_orders VALUES (1, 50);

statement ok
PRAGMA refresh('cte_joined');

query I
SELECT COUNT(*) FROM (
    SELECT u.name, o.amount FROM cte_users u INNER JOIN cte_orders o ON u.id = o.user_id
    EXCEPT ALL
    SELECT name, amount FROM cte_joined
);
----
0

query I
SELECT COUNT(*) FROM (
    SELECT name, amount FROM cte_joined
    EXCEPT ALL
    SELECT u.name, o.amount FROM cte_users u INNER JOIN cte_orders o ON u.id = o.user_id
);
----
0

# ============================================================
# 3-table join (deeply nested CTEs)
# ============================================================

statement ok
CREATE TABLE cte_t1 (id INT, val VARCHAR);

statement ok
CREATE TABLE cte_t2 (t1_id INT, t2_id INT);

statement ok
CREATE TABLE cte_t3 (id INT, label VARCHAR);

statement ok
INSERT INTO cte_t1 VALUES (1, 'x'), (2, 'y');

statement ok
INSERT INTO cte_t2 VALUES (1, 10), (2, 20);

statement ok
INSERT INTO cte_t3 VALUES (10, 'alpha'), (20, 'beta');

statement ok
CREATE MATERIALIZED VIEW cte_3way AS
    SELECT t1.val, t3.label
    FROM cte_t1 t1
    INNER JOIN cte_t2 t2 ON t1.id = t2.t1_id
    INNER JOIN cte_t3 t3 ON t2.t2_id = t3.id;

statement ok
INSERT INTO cte_t2 VALUES (1, 20);

statement ok
PRAGMA refresh('cte_3way');

query I
SELECT COUNT(*) FROM (
    SELECT t1.val, t3.label FROM cte_t1 t1 INNER JOIN cte_t2 t2 ON t1.id = t2.t1_id INNER JOIN cte_t3 t3 ON t2.t2_id = t3.id
    EXCEPT ALL
    SELECT val, label FROM cte_3way
);
----
0

query I
SELECT COUNT(*) FROM (
    SELECT val, label FROM cte_3way
    EXCEPT ALL
    SELECT t1.val, t3.label FROM cte_t1 t1 INNER JOIN cte_t2 t2 ON t1.id = t2.t1_id INNER JOIN cte_t3 t3 ON t2.t2_id = t3.id
);
----
0

# Delete and verify
statement ok
DELETE FROM cte_t2 WHERE t1_id = 1 AND t2_id = 10;

statement ok
PRAGMA refresh('cte_3way');

query I
SELECT COUNT(*) FROM (
    SELECT t1.val, t3.label FROM cte_t1 t1 INNER JOIN cte_t2 t2 ON t1.id = t2.t1_id INNER JOIN cte_t3 t3 ON t2.t2_id = t3.id
    EXCEPT ALL
    SELECT val, label FROM cte_3way
);
----
0

query I
SELECT COUNT(*) FROM (
    SELECT val, label FROM cte_3way
    EXCEPT ALL
    SELECT t1.val, t3.label FROM cte_t1 t1 INNER JOIN cte_t2 t2 ON t1.id = t2.t1_id INNER JOIN cte_t3 t3 ON t2.t2_id = t3.id
);
----
0

# ============================================================
# Scalar aggregate (single-row MV via CTE)
# ============================================================

statement ok
CREATE TABLE cte_scores (val INT);

statement ok
INSERT INTO cte_scores VALUES (10), (20), (30);

statement ok
CREATE MATERIALIZED VIEW cte_total AS SELECT SUM(val) AS total, COUNT(*) AS cnt FROM cte_scores;

statement ok
INSERT INTO cte_scores VALUES (40);

statement ok
PRAGMA refresh('cte_total');

query II
SELECT total, cnt FROM cte_total;
----
100	4

# ============================================================
# DISTINCT via CTE (plan rewrite adds COUNT)
# ============================================================

statement ok
CREATE TABLE cte_colors (color VARCHAR);

statement ok
INSERT INTO cte_colors VALUES ('red'), ('blue'), ('red'), ('green');

statement ok
CREATE MATERIALIZED VIEW cte_distinct AS SELECT DISTINCT color FROM cte_colors;

statement ok
INSERT INTO cte_colors VALUES ('red'), ('yellow');

statement ok
PRAGMA refresh('cte_distinct');

query I
SELECT COUNT(*) FROM (
    SELECT DISTINCT color FROM cte_colors
    EXCEPT ALL
    SELECT color FROM cte_distinct
);
----
0

# ==========================================
# CTE with aggregate + HAVING
# ==========================================

statement ok
CREATE TABLE cte_sales (region VARCHAR, amount INT);

statement ok
INSERT INTO cte_sales VALUES ('US', 100), ('US', 200), ('EU', 50), ('EU', 30);

statement ok
CREATE MATERIALIZED VIEW cte_big AS
    SELECT region, SUM(amount) AS total FROM cte_sales GROUP BY region HAVING SUM(amount) > 100;

query I
SELECT COUNT(*) FROM (
    SELECT region, SUM(amount) AS total FROM cte_sales GROUP BY region HAVING SUM(amount) > 100
    EXCEPT ALL SELECT * FROM cte_big
);
----
0

statement ok
INSERT INTO cte_sales VALUES ('EU', 200);

statement ok
PRAGMA refresh('cte_big');

query I
SELECT COUNT(*) FROM (
    SELECT region, SUM(amount) AS total FROM cte_sales GROUP BY region HAVING SUM(amount) > 100
    EXCEPT ALL SELECT * FROM cte_big
);
----
0

query I
SELECT COUNT(*) FROM (
    SELECT * FROM cte_big
    EXCEPT ALL SELECT region, SUM(amount) FROM cte_sales GROUP BY region HAVING SUM(amount) > 100
);
----
0

# ==========================================
# CTE with self-join
# ==========================================

statement ok
CREATE TABLE cte_emp (id INT, name VARCHAR, mgr_id INT);

statement ok
INSERT INTO cte_emp VALUES (1, 'Alice', NULL), (2, 'Bob', 1), (3, 'Carol', 1);

statement ok
CREATE MATERIALIZED VIEW cte_reports AS
    SELECT e.name AS employee, m.name AS manager
    FROM cte_emp e INNER JOIN cte_emp m ON e.mgr_id = m.id;

statement ok
INSERT INTO cte_emp VALUES (4, 'Dave', 2);

statement ok
PRAGMA refresh('cte_reports');

query I
SELECT COUNT(*) FROM (
    SELECT e.name, m.name FROM cte_emp e INNER JOIN cte_emp m ON e.mgr_id = m.id
    EXCEPT ALL SELECT * FROM cte_reports
);
----
0

query I
SELECT COUNT(*) FROM (
    SELECT * FROM cte_reports
    EXCEPT ALL SELECT e.name, m.name FROM cte_emp e INNER JOIN cte_emp m ON e.mgr_id = m.id
);
----
0

# --- CTE-wrapped AVG decomposes correctly (q0535 regression) ---
# Bug: LPTS can't serialize LOGICAL_CTE_REF, so the CTE-wrapped plan fell back to
# the original SQL at CREATE time — meaning the data table stored the raw avg()
# column with no hidden sum/count, and the delta CTE tried to SUM the averages
# during refresh, yielding wildly incorrect group averages after any delta.
# Fix: inline the CTE at plan level before IVM rewrites so LPTS sees a flat
# PROJECTION → AGGREGATE plan and RewriteDerivedAggregates can decompose AVG.

statement ok
CREATE TABLE cte_avg_t(id INT, tier VARCHAR, bal INT);

statement ok
INSERT INTO cte_avg_t VALUES
    (1, 'A', 100), (2, 'A', 200), (3, 'B', 50), (4, 'B', 150), (5, 'C', 300);

statement ok
CREATE MATERIALIZED VIEW mv_cte_avg AS
    WITH tiers AS (SELECT id, tier, bal FROM cte_avg_t)
    SELECT tier, COUNT(*) AS cnt, AVG(bal) AS avg_bal FROM tiers GROUP BY tier;

query I
SELECT count(*) FROM (
    SELECT * FROM mv_cte_avg
    EXCEPT ALL SELECT tier, COUNT(*), AVG(bal) FROM cte_avg_t GROUP BY tier
);
----
0

# Delta: update values so AVG changes.
statement ok
UPDATE cte_avg_t SET bal = bal + 1000 WHERE tier = 'A';

statement ok
INSERT INTO cte_avg_t VALUES (6, 'B', 250);

statement ok
PRAGMA refresh('mv_cte_avg');

query I
SELECT count(*) FROM (
    SELECT * FROM mv_cte_avg
    EXCEPT ALL SELECT tier, COUNT(*), AVG(bal) FROM cte_avg_t GROUP BY tier
);
----
0

query I
SELECT count(*) FROM (
    SELECT tier, COUNT(*), AVG(bal) FROM cte_avg_t GROUP BY tier
    EXCEPT ALL SELECT * FROM mv_cte_avg
);
----
0

# ============================================================
# CTE aggregate joined to dimension-side pass-through columns
# ============================================================

statement ok
CREATE TABLE cte_joinagg_customer(w INT, credit VARCHAR, bal DOUBLE);

statement ok
CREATE TABLE cte_joinagg_wh(w INT, tax DOUBLE);

statement ok
INSERT INTO cte_joinagg_customer VALUES
    (1, 'GC', 10), (1, 'GC', 20), (1, 'BC', 50),
    (2, 'GC', 100), (2, 'GC', 130);

statement ok
INSERT INTO cte_joinagg_wh VALUES (1, 0.05), (2, 0.10);

statement ok
CREATE MATERIALIZED VIEW mv_cte_joinagg AS
    WITH customer_segments AS (
        SELECT w,
               CASE WHEN credit = 'GC' THEN 'good' ELSE 'bad' END AS credit_seg,
               AVG(bal) AS avg_bal,
               STDDEV(bal) AS std_bal,
               COUNT(*) AS cnt
        FROM cte_joinagg_customer
        GROUP BY w, CASE WHEN credit = 'GC' THEN 'good' ELSE 'bad' END
    )
    SELECT cs.w, cs.credit_seg, cs.avg_bal, cs.std_bal, cs.cnt, wh.tax
    FROM customer_segments cs JOIN cte_joinagg_wh wh ON cs.w = wh.w;

query I
SELECT type FROM openivm_views WHERE view_name = 'mv_cte_joinagg';
----
6

statement ok
UPDATE cte_joinagg_customer SET bal = 100 WHERE w = 1 AND credit = 'GC' AND bal = 10;

statement ok
UPDATE cte_joinagg_wh SET tax = 0.15 WHERE w = 2;

statement ok
PRAGMA refresh('mv_cte_joinagg');

query I
SELECT COUNT(*) FROM (
    SELECT * FROM mv_cte_joinagg
    EXCEPT ALL
    SELECT * FROM (
        WITH customer_segments AS (
            SELECT w,
                   CASE WHEN credit = 'GC' THEN 'good' ELSE 'bad' END AS credit_seg,
                   AVG(bal) AS avg_bal,
                   STDDEV(bal) AS std_bal,
                   COUNT(*) AS cnt
            FROM cte_joinagg_customer
            GROUP BY w, CASE WHEN credit = 'GC' THEN 'good' ELSE 'bad' END
        )
        SELECT cs.w, cs.credit_seg, cs.avg_bal, cs.std_bal, cs.cnt, wh.tax
        FROM customer_segments cs JOIN cte_joinagg_wh wh ON cs.w = wh.w
    )
);
----
0

query I
SELECT COUNT(*) FROM (
    SELECT * FROM (
        WITH customer_segments AS (
            SELECT w,
                   CASE WHEN credit = 'GC' THEN 'good' ELSE 'bad' END AS credit_seg,
                   AVG(bal) AS avg_bal,
                   STDDEV(bal) AS std_bal,
                   COUNT(*) AS cnt
            FROM cte_joinagg_customer
            GROUP BY w, CASE WHEN credit = 'GC' THEN 'good' ELSE 'bad' END
        )
        SELECT cs.w, cs.credit_seg, cs.avg_bal, cs.std_bal, cs.cnt, wh.tax
        FROM customer_segments cs JOIN cte_joinagg_wh wh ON cs.w = wh.w
    )
    EXCEPT ALL
    SELECT * FROM mv_cte_joinagg
);
----
0

# ============================================================
# HAVING inside a CTE body.
# The outer uses the CTE in a JOIN; HAVING belongs to the CTE's own aggregate,
# not the MV's output. Two things must work:
#   1. StripHavingFilter must not strip a FILTER that sits under a MATERIALIZED_CTE
#      — otherwise it extracts the predicate with bindings that don't line up with
#      the view's top-level column names, producing a view WHERE like
#      `(I_NAME > 100)` on a VARCHAR column.
#   2. The parser must relax CTE_MATERIALIZE_ALWAYS -> CTE_MATERIALIZE_DEFAULT before
#      calling CTEInlining. DuckDB's binder defaults to ALWAYS, which makes
#      CTEInlining bail out and keep LOGICAL_MATERIALIZED_CTE in the plan — but IVM
#      has no delta-consolidation rule for LOGICAL_CTE_REF. Relaxing the flag lets
#      the CTE body fold into the outer plan. Because the stored aggregate-filter
#      query is backed by a join, GROUP_RECOMPUTE must use current-vs-stored diff
#      affected keys; source-delta affected keys can miss batched deletes on both
#      join inputs.
# ============================================================

statement ok
CREATE TABLE cte_hav_item (i_id INT, i_name VARCHAR, i_price DECIMAL(18,3));

statement ok
CREATE TABLE cte_hav_ol (ol_i_id INT, ol_amount DECIMAL(18,3));

statement ok
INSERT INTO cte_hav_item VALUES (1, 'a', 10), (2, 'b', 20), (3, 'c', 30);

statement ok
INSERT INTO cte_hav_ol VALUES (1, 50), (1, 60), (2, 30), (3, 40), (3, 60), (3, 50);

statement ok
CREATE MATERIALIZED VIEW mv_cte_having AS
    WITH item_revenue AS (
        SELECT ol_i_id, SUM(ol_amount) AS rev FROM cte_hav_ol GROUP BY ol_i_id
        HAVING SUM(ol_amount) > 100
    )
    SELECT i.i_id, i.i_name, i.i_price, ir.rev
    FROM cte_hav_item i JOIN item_revenue ir ON i.i_id = ir.ol_i_id;

query I
SELECT type FROM openivm_views WHERE view_name = 'mv_cte_having';
----
6

query T
SELECT group_recompute_affected_mode FROM openivm_views WHERE view_name = 'mv_cte_having';
----
current_diff

query I
SELECT group_recompute_source_occurrences_json IS NOT NULL FROM openivm_views WHERE view_name = 'mv_cte_having';
----
true

query I
SELECT count(*) FROM (
    SELECT * FROM mv_cte_having
    EXCEPT ALL
    (WITH item_revenue AS (SELECT ol_i_id, SUM(ol_amount) AS rev FROM cte_hav_ol GROUP BY ol_i_id HAVING SUM(ol_amount) > 100)
     SELECT i.i_id, i.i_name, i.i_price, ir.rev FROM cte_hav_item i JOIN item_revenue ir ON i.i_id = ir.ol_i_id)
);
----
0

query I
SELECT count(*) FROM (
    (WITH item_revenue AS (SELECT ol_i_id, SUM(ol_amount) AS rev FROM cte_hav_ol GROUP BY ol_i_id HAVING SUM(ol_amount) > 100)
     SELECT i.i_id, i.i_name, i.i_price, ir.rev FROM cte_hav_item i JOIN item_revenue ir ON i.i_id = ir.ol_i_id)
    EXCEPT ALL SELECT * FROM mv_cte_having
);
----
0

# Batched DML: flip one item below threshold, push another above
statement ok
DELETE FROM cte_hav_ol WHERE ol_i_id = 1 AND ol_amount = 60;

statement ok
INSERT INTO cte_hav_ol VALUES (2, 80);

statement ok
INSERT INTO cte_hav_item VALUES (4, 'd', 40);

statement ok
INSERT INTO cte_hav_ol VALUES (4, 150);

statement ok
SET openivm_profile_refresh = true;

statement ok
PRAGMA refresh('mv_cte_having');

query I
SELECT count(*) > 0 FROM openivm_refresh_profile
WHERE view_name = 'mv_cte_having'
  AND step_name = 'execute_refresh_sql_stmt'
  AND contains(detail, 'openivm_current_mv_cte_having');
----
true

query I
SELECT count(*) FROM (
    SELECT * FROM mv_cte_having
    EXCEPT ALL
    (WITH item_revenue AS (SELECT ol_i_id, SUM(ol_amount) AS rev FROM cte_hav_ol GROUP BY ol_i_id HAVING SUM(ol_amount) > 100)
     SELECT i.i_id, i.i_name, i.i_price, ir.rev FROM cte_hav_item i JOIN item_revenue ir ON i.i_id = ir.ol_i_id)
);
----
0

query I
SELECT count(*) FROM (
    (WITH item_revenue AS (SELECT ol_i_id, SUM(ol_amount) AS rev FROM cte_hav_ol GROUP BY ol_i_id HAVING SUM(ol_amount) > 100)
     SELECT i.i_id, i.i_name, i.i_price, ir.rev FROM cte_hav_item i JOIN item_revenue ir ON i.i_id = ir.ol_i_id)
    EXCEPT ALL SELECT * FROM mv_cte_having
);
----
0

statement ok
SET openivm_profile_refresh = false;

# Batched delete from both sides of the join. Source-delta affected keys can miss
# this because each replaced source sees the other side's post-DML table and
# produces no joined row for the deleted key.
statement ok
DELETE FROM cte_hav_item WHERE i_id = 4;

statement ok
DELETE FROM cte_hav_ol WHERE ol_i_id = 4;

statement ok
PRAGMA refresh('mv_cte_having');

query I
SELECT count(*) FROM (
    SELECT * FROM mv_cte_having
    EXCEPT ALL
    (WITH item_revenue AS (SELECT ol_i_id, SUM(ol_amount) AS rev FROM cte_hav_ol GROUP BY ol_i_id HAVING SUM(ol_amount) > 100)
     SELECT i.i_id, i.i_name, i.i_price, ir.rev FROM cte_hav_item i JOIN item_revenue ir ON i.i_id = ir.ol_i_id)
);
----
0

query I
SELECT count(*) FROM (
    (WITH item_revenue AS (SELECT ol_i_id, SUM(ol_amount) AS rev FROM cte_hav_ol GROUP BY ol_i_id HAVING SUM(ol_amount) > 100)
     SELECT i.i_id, i.i_name, i.i_price, ir.rev FROM cte_hav_item i JOIN item_revenue ir ON i.i_id = ir.ol_i_id)
    EXCEPT ALL SELECT * FROM mv_cte_having
);
----
0

# ============================================================
# Duplicate column names in SELECT.
# `SELECT W_ID, W_ID …` and `SELECT col, col, COUNT(*) GROUP BY col, col`
# generate LPTS output with duplicate output columns; without dedup,
# `CREATE TABLE openivm_data_mv AS <view_query>` rejects duplicates.
# Both output_names AND aggregate_columns get `_N` suffixes so:
#   1. The data table has unique columns.
#   2. The unique index and MERGE ON/UPDATE SET clauses reference the deduped
#      names — otherwise the second occurrence gets treated as an aggregate
#      column and the MERGE adds values instead of matching them.
# ============================================================

statement ok
CREATE TABLE dup_t (w_id INT, w_tax DECIMAL(10,3));

statement ok
INSERT INTO dup_t VALUES (1, 0.1), (2, 0.2), (3, 0.1);

statement ok
CREATE MATERIALIZED VIEW mv_dup_distinct AS SELECT DISTINCT w_id, w_id FROM dup_t;

query II
SELECT * FROM mv_dup_distinct ORDER BY w_id;
----
1	1
2	2
3	3

statement ok
CREATE MATERIALIZED VIEW mv_dup_agg AS SELECT w_tax, w_tax, COUNT(*) FROM dup_t GROUP BY w_tax, w_tax;

query III
SELECT w_tax, w_tax_1, count_star FROM mv_dup_agg ORDER BY w_tax;
----
0.100	0.100	2
0.200	0.200	1

statement ok
INSERT INTO dup_t VALUES (4, 0.2), (1, 0.3);

statement ok
PRAGMA refresh('mv_dup_distinct');

statement ok
PRAGMA refresh('mv_dup_agg');

query II
SELECT * FROM mv_dup_distinct ORDER BY w_id;
----
1	1
2	2
3	3
4	4

query III
SELECT w_tax, w_tax_1, count_star FROM mv_dup_agg ORDER BY w_tax;
----
0.100	0.100	2
0.200	0.200	2
0.300	0.300	1

# ============================================================
# CTE self-join (regression — pre-fix the optimizer's CTE
# materialization left a single physical scan referenced from
# both join sides, so IncrementalJoinRule's inclusion-exclusion saw one
# leaf instead of two and missed the cross-term Δt × t_now /
# t_now × Δt that produces new pairs from a single delta.
# Fix: InlineCteRefs in src/core/plan_rewrite.cpp deep-copies
# the CTE definition per reference before any IVM rewrite runs.)
# ============================================================

statement ok
CREATE TABLE selfjoin_t (id INT, k INT, v INT);

statement ok
INSERT INTO selfjoin_t VALUES (1,1,10), (2,1,20), (3,2,30), (4,2,40);

statement ok
CREATE MATERIALIZED VIEW selfjoin_mv AS
    WITH c AS (SELECT id, k, v FROM selfjoin_t)
    SELECT x.id AS xid, x.v AS xv, y.id AS yid, y.v AS yv
    FROM c x JOIN c y ON x.k = y.k AND x.id < y.id;

# Initial state: 1 pair per group.
query I
SELECT COUNT(*) FROM (
    SELECT xid, xv, yid, yv FROM selfjoin_mv
    EXCEPT ALL
    SELECT x.id, x.v, y.id, y.v
    FROM selfjoin_t x JOIN selfjoin_t y ON x.k = y.k AND x.id < y.id
);
----
0

# Insert one new row: it must pair with each pre-existing row in the
# same group. For k=1 with new id=5, two new pairs (1,5) and (2,5).
statement ok
INSERT INTO selfjoin_t VALUES (5, 1, 50);

statement ok
PRAGMA refresh('selfjoin_mv');

query I
SELECT COUNT(*) FROM (
    SELECT xid, xv, yid, yv FROM selfjoin_mv
    EXCEPT ALL
    SELECT x.id, x.v, y.id, y.v
    FROM selfjoin_t x JOIN selfjoin_t y ON x.k = y.k AND x.id < y.id
);
----
0

query I
SELECT COUNT(*) FROM (
    SELECT x.id, x.v, y.id, y.v
    FROM selfjoin_t x JOIN selfjoin_t y ON x.k = y.k AND x.id < y.id
    EXCEPT ALL
    SELECT xid, xv, yid, yv FROM selfjoin_mv
);
----
0

# Mixed batch: new row in another group + delete an existing row.
statement ok
INSERT INTO selfjoin_t VALUES (6, 2, 60);

statement ok
DELETE FROM selfjoin_t WHERE id = 1;

statement ok
PRAGMA refresh('selfjoin_mv');

query I
SELECT COUNT(*) FROM (
    SELECT xid, xv, yid, yv FROM selfjoin_mv
    EXCEPT ALL
    SELECT x.id, x.v, y.id, y.v
    FROM selfjoin_t x JOIN selfjoin_t y ON x.k = y.k AND x.id < y.id
);
----
0

query I
SELECT COUNT(*) FROM (
    SELECT x.id, x.v, y.id, y.v
    FROM selfjoin_t x JOIN selfjoin_t y ON x.k = y.k AND x.id < y.id
    EXCEPT ALL
    SELECT xid, xv, yid, yv FROM selfjoin_mv
);
----
0

# Classification: SIMPLE_PROJECTION (type 2), not FULL_REFRESH.
query I
SELECT type FROM openivm_views WHERE view_name = 'selfjoin_mv';
----
2

# ==========================================
# JOIN with inner subquery aggregate (join-key-group fallback)
# Regression: must route to GROUP_RECOMPUTE with join key as group key, not SIMPLE_AGGREGATE
# ==========================================

statement ok
CREATE TABLE jia_customer (c_id INT, c_w_id INT, c_balance DOUBLE);

statement ok
CREATE TABLE jia_history (h_c_id INT, h_amount DOUBLE);

statement ok
INSERT INTO jia_customer VALUES (1, 1, 50.0), (2, 1, 100.0), (3, 2, 75.0);

statement ok
INSERT INTO jia_history VALUES (1, 10.0), (1, 20.0), (2, 5.0), (3, 30.0);

statement ok
CREATE MATERIALIZED VIEW mv_jia AS
    SELECT c.c_id, agg.avg_val
    FROM jia_customer c
    JOIN (SELECT h_c_id, AVG(h_amount) AS avg_val FROM jia_history GROUP BY h_c_id) agg
      ON c.c_id = agg.h_c_id;

# Verify classification is GROUP_RECOMPUTE (6)
query I
SELECT type FROM openivm_views WHERE view_name = 'mv_jia';
----
6

statement ok
INSERT INTO jia_history VALUES (2, 15.0);

statement ok
DELETE FROM jia_customer WHERE c_id = 3;

statement ok
PRAGMA refresh('mv_jia');

query I
SELECT COUNT(*) FROM (
    (SELECT c.c_id, agg.avg_val
     FROM jia_customer c
     JOIN (SELECT h_c_id, AVG(h_amount) AS avg_val FROM jia_history GROUP BY h_c_id) agg
       ON c.c_id = agg.h_c_id)
    EXCEPT ALL SELECT * FROM mv_jia
);
----
0

query I
SELECT COUNT(*) FROM (
    SELECT * FROM mv_jia
    EXCEPT ALL
    (SELECT c.c_id, agg.avg_val
     FROM jia_customer c
     JOIN (SELECT h_c_id, AVG(h_amount) AS avg_val FROM jia_history GROUP BY h_c_id) agg
       ON c.c_id = agg.h_c_id)
);
----
0

# Second refresh: insert into history (affects avg) + insert new customer row
statement ok
INSERT INTO jia_history VALUES (1, 30.0);

statement ok
INSERT INTO jia_customer VALUES (4, 2, 200.0);

statement ok
PRAGMA refresh('mv_jia');

query I
SELECT COUNT(*) FROM (
    (SELECT c.c_id, agg.avg_val
     FROM jia_customer c
     JOIN (SELECT h_c_id, AVG(h_amount) AS avg_val FROM jia_history GROUP BY h_c_id) agg
       ON c.c_id = agg.h_c_id)
    EXCEPT ALL SELECT * FROM mv_jia
);
----
0

query I
SELECT COUNT(*) FROM (
    SELECT * FROM mv_jia
    EXCEPT ALL
    (SELECT c.c_id, agg.avg_val
     FROM jia_customer c
     JOIN (SELECT h_c_id, AVG(h_amount) AS avg_val FROM jia_history GROUP BY h_c_id) agg
       ON c.c_id = agg.h_c_id)
);
----
0

# ==========================================
# CTE re-aggregate: outer GROUP BY over inner CTE aggregate
# Regression: first-found-wins for group_index must preserve the outermost aggregate's group key
# ==========================================

statement ok
CREATE TABLE cra_customer (c_w_id INT, c_d_id INT, c_balance DOUBLE);

statement ok
INSERT INTO cra_customer VALUES (1, 1, 100.0), (1, 1, 50.0), (1, 2, 200.0), (2, 1, 75.0);

statement ok
CREATE MATERIALIZED VIEW mv_cra AS
    WITH mat AS (
        SELECT c_w_id, c_d_id, SUM(c_balance) AS tot, COUNT(*) AS n
        FROM cra_customer GROUP BY c_w_id, c_d_id
    )
    SELECT c_w_id, SUM(tot) AS w_tot, SUM(n) AS w_cnt, COUNT(*) AS dists
    FROM mat GROUP BY c_w_id;

# Verify classification is GROUP_RECOMPUTE (6): outer COUNT(*) counts inner groups (non-linear over source deltas)
query I
SELECT type FROM openivm_views WHERE view_name = 'mv_cra';
----
6

statement ok
INSERT INTO cra_customer VALUES (1, 3, 999.0), (2, 1, 25.0);

statement ok
PRAGMA refresh('mv_cra');

query I
SELECT COUNT(*) FROM (
    (SELECT c_w_id, SUM(tot) AS w_tot, SUM(n) AS w_cnt, COUNT(*) AS dists
     FROM (SELECT c_w_id, c_d_id, SUM(c_balance) AS tot, COUNT(*) AS n FROM cra_customer GROUP BY c_w_id, c_d_id) mat
     GROUP BY c_w_id)
    EXCEPT ALL SELECT * FROM mv_cra
);
----
0

query I
SELECT COUNT(*) FROM (
    SELECT * FROM mv_cra
    EXCEPT ALL
    (SELECT c_w_id, SUM(tot) AS w_tot, SUM(n) AS w_cnt, COUNT(*) AS dists
     FROM (SELECT c_w_id, c_d_id, SUM(c_balance) AS tot, COUNT(*) AS n FROM cra_customer GROUP BY c_w_id, c_d_id) mat
     GROUP BY c_w_id)
);
----
0

# ==========================================
# CTE nested aggregate: count filtered inner grouped SUM via aux-state transitions
# ==========================================

statement ok
CREATE TABLE fgc_customer (c_w_id INT, c_id INT, c_balance DOUBLE);

statement ok
INSERT INTO fgc_customer VALUES (1, 1, 100.0), (2, 1, -50.0), (3, 1, 10.0);

statement ok
CREATE MATERIALIZED VIEW mv_fgc AS
    WITH step1 AS (
        SELECT c_w_id, SUM(c_balance) AS total
        FROM fgc_customer
        GROUP BY c_w_id
    ),
    step2 AS (
        SELECT * FROM step1 WHERE total < 0
    ),
    step3 AS (
        SELECT COUNT(*) AS neg_warehouses FROM step2
    )
    SELECT * FROM step3;

query I
SELECT type FROM openivm_views WHERE view_name = 'mv_fgc';
----
1

query I
SELECT aggregate_decomposition_json IS NOT NULL FROM openivm_views WHERE view_name = 'mv_fgc';
----
true

statement ok
INSERT INTO fgc_customer VALUES (1, 2, -200.0);

statement ok
DELETE FROM fgc_customer WHERE c_w_id = 2 AND c_id = 1;

statement ok
UPDATE fgc_customer SET c_balance = -20.0 WHERE c_w_id = 3 AND c_id = 1;

statement ok
PRAGMA refresh('mv_fgc');

query I
SELECT COUNT(*) FROM (
    (WITH step1 AS (
        SELECT c_w_id, SUM(c_balance) AS total
        FROM fgc_customer
        GROUP BY c_w_id
    ),
    step2 AS (
        SELECT * FROM step1 WHERE total < 0
    ),
    step3 AS (
        SELECT COUNT(*) AS neg_warehouses FROM step2
    )
    SELECT * FROM step3)
    EXCEPT ALL
    SELECT * FROM mv_fgc
);
----
0

query I
SELECT COUNT(*) FROM (
    SELECT * FROM mv_fgc
    EXCEPT ALL
    (WITH step1 AS (
        SELECT c_w_id, SUM(c_balance) AS total
        FROM fgc_customer
        GROUP BY c_w_id
    ),
    step2 AS (
        SELECT * FROM step1 WHERE total < 0
    ),
    step3 AS (
        SELECT COUNT(*) AS neg_warehouses FROM step2
    )
    SELECT * FROM step3)
);
----
0

# ==========================================
# Reused CTE aggregate under joins: affected keys must use visible output columns
# ==========================================

statement ok
CREATE TABLE cte_wh (w_id INT, w_name VARCHAR, w_ytd DOUBLE);

statement ok
CREATE TABLE cte_dist (d_w_id INT, d_id INT, d_name VARCHAR);

statement ok
CREATE TABLE cte_ol (ol_w_id INT, ol_d_id INT, ol_o_id INT, ol_number INT, ol_amount DOUBLE);

statement ok
INSERT INTO cte_wh VALUES (1, 'w1', 100.0), (2, 'w2', 200.0);

statement ok
INSERT INTO cte_dist VALUES (1, 1, 'd1'), (1, 2, 'd2'), (2, 1, 'd3');

statement ok
INSERT INTO cte_ol VALUES
    (1, 1, 1, 1, 10.0),
    (1, 1, 1, 2, 20.0),
    (1, 2, 2, 1, 30.0),
    (2, 1, 3, 1, 40.0);

statement ok
CREATE MATERIALIZED VIEW mv_cte_join_keys AS
WITH ol_by_district AS (
    SELECT ol_w_id, ol_d_id, SUM(ol_amount) AS district_revenue, COUNT(*) AS line_count
    FROM cte_ol
    GROUP BY ol_w_id, ol_d_id
),
ol_by_warehouse AS (
    SELECT ol_w_id, SUM(district_revenue) AS warehouse_revenue, SUM(line_count) AS total_lines,
           COUNT(*) AS district_count
    FROM ol_by_district
    GROUP BY ol_w_id
)
SELECT w.w_id, w.w_name, w.w_ytd, ow.warehouse_revenue, ow.total_lines, ow.district_count,
       d.d_id, d.d_name, od.district_revenue, od.line_count
FROM cte_wh w
JOIN ol_by_warehouse ow ON w.w_id = ow.ol_w_id
JOIN cte_dist d ON w.w_id = d.d_w_id
JOIN ol_by_district od ON d.d_w_id = od.ol_w_id AND d.d_id = od.ol_d_id;

query I
SELECT type FROM openivm_views WHERE view_name = 'mv_cte_join_keys';
----
6

query I
SELECT group_columns FROM openivm_views WHERE view_name = 'mv_cte_join_keys';
----
w_id,d_id

statement ok
UPDATE cte_ol SET ol_amount = 15.0 WHERE ol_w_id = 1 AND ol_d_id = 1 AND ol_o_id = 1 AND ol_number = 1;

statement ok
INSERT INTO cte_ol VALUES (2, 1, 4, 1, 5.0);

statement ok
PRAGMA refresh('mv_cte_join_keys');

query I
SELECT COUNT(*) FROM (
    SELECT * FROM mv_cte_join_keys
    EXCEPT ALL
    SELECT * FROM (WITH ol_by_district AS (
        SELECT ol_w_id, ol_d_id, SUM(ol_amount) AS district_revenue, COUNT(*) AS line_count
        FROM cte_ol
        GROUP BY ol_w_id, ol_d_id
    ),
    ol_by_warehouse AS (
        SELECT ol_w_id, SUM(district_revenue) AS warehouse_revenue, SUM(line_count) AS total_lines,
               COUNT(*) AS district_count
        FROM ol_by_district
        GROUP BY ol_w_id
    )
    SELECT w.w_id, w.w_name, w.w_ytd, ow.warehouse_revenue, ow.total_lines, ow.district_count,
           d.d_id, d.d_name, od.district_revenue, od.line_count
    FROM cte_wh w
    JOIN ol_by_warehouse ow ON w.w_id = ow.ol_w_id
    JOIN cte_dist d ON w.w_id = d.d_w_id
    JOIN ol_by_district od ON d.d_w_id = od.ol_w_id AND d.d_id = od.ol_d_id
    ) _expected
);
----
0

query I
SELECT COUNT(*) FROM (
    SELECT * FROM (WITH ol_by_district AS (
        SELECT ol_w_id, ol_d_id, SUM(ol_amount) AS district_revenue, COUNT(*) AS line_count
        FROM cte_ol
        GROUP BY ol_w_id, ol_d_id
    ),
    ol_by_warehouse AS (
        SELECT ol_w_id, SUM(district_revenue) AS warehouse_revenue, SUM(line_count) AS total_lines,
               COUNT(*) AS district_count
        FROM ol_by_district
        GROUP BY ol_w_id
    )
    SELECT w.w_id, w.w_name, w.w_ytd, ow.warehouse_revenue, ow.total_lines, ow.district_count,
           d.d_id, d.d_name, od.district_revenue, od.line_count
    FROM cte_wh w
    JOIN ol_by_warehouse ow ON w.w_id = ow.ol_w_id
    JOIN cte_dist d ON w.w_id = d.d_w_id
    JOIN ol_by_district od ON d.d_w_id = od.ol_w_id AND d.d_id = od.ol_d_id
    ) _expected
    EXCEPT ALL
    SELECT * FROM mv_cte_join_keys
);
----
0

# Second refresh with deletions
statement ok
DELETE FROM cra_customer WHERE c_d_id = 3;

statement ok
INSERT INTO cra_customer VALUES (3, 1, 500.0);

statement ok
PRAGMA refresh('mv_cra');

query I
SELECT COUNT(*) FROM (
    (SELECT c_w_id, SUM(tot) AS w_tot, SUM(n) AS w_cnt, COUNT(*) AS dists
     FROM (SELECT c_w_id, c_d_id, SUM(c_balance) AS tot, COUNT(*) AS n FROM cra_customer GROUP BY c_w_id, c_d_id) mat
     GROUP BY c_w_id)
    EXCEPT ALL SELECT * FROM mv_cra
);
----
0

query I
SELECT COUNT(*) FROM (
    SELECT * FROM mv_cra
    EXCEPT ALL
    (SELECT c_w_id, SUM(tot) AS w_tot, SUM(n) AS w_cnt, COUNT(*) AS dists
     FROM (SELECT c_w_id, c_d_id, SUM(c_balance) AS tot, COUNT(*) AS n FROM cra_customer GROUP BY c_w_id, c_d_id) mat
     GROUP BY c_w_id)
);
----
0
