# name: test/sql/ducklake_inner_join.test
# description: Test IVM inner joins with DuckLake base tables
# group: [sql]

require openivm

require parquet

statement ok
INSTALL ducklake;

statement ok
LOAD ducklake;

statement ok
ATTACH '__TEST_DIR__/ducklake_inner_join.db' AS dl (TYPE ducklake);

# ==========================================
# Test 1: 2-table INNER JOIN — INSERT left, then right
# ==========================================

statement ok
CREATE TABLE dl.customers (id INT, name VARCHAR);

statement ok
CREATE TABLE dl.purchases (cust_id INT, item VARCHAR, price INT);

statement ok
INSERT INTO dl.customers VALUES (1, 'Alice'), (2, 'Bob'), (3, 'Carol');

statement ok
INSERT INTO dl.purchases VALUES (1, 'Widget', 10), (2, 'Gadget', 25);

statement ok
CREATE MATERIALIZED VIEW dl.customer_purchases AS
    SELECT c.name, p.item, p.price
    FROM dl.customers c INNER JOIN dl.purchases p ON c.id = p.cust_id;

statement ok
PRAGMA refresh('customer_purchases');

# Cross-check after full refresh
query I
SELECT COUNT(*) FROM (
    SELECT c.name, p.item, p.price FROM dl.customers c INNER JOIN dl.purchases p ON c.id = p.cust_id
    EXCEPT ALL
    SELECT name, item, price FROM dl.customer_purchases
);
----
0

query I
SELECT COUNT(*) FROM (
    SELECT name, item, price FROM dl.customer_purchases
    EXCEPT ALL
    SELECT c.name, p.item, p.price FROM dl.customers c INNER JOIN dl.purchases p ON c.id = p.cust_id
);
----
0

# INSERT on right side (purchases)
statement ok
INSERT INTO dl.purchases VALUES (1, 'Doohickey', 5), (3, 'Gizmo', 50);

statement ok
PRAGMA refresh('customer_purchases');

query I
SELECT COUNT(*) FROM (
    SELECT c.name, p.item, p.price FROM dl.customers c INNER JOIN dl.purchases p ON c.id = p.cust_id
    EXCEPT ALL
    SELECT name, item, price FROM dl.customer_purchases
);
----
0

query I
SELECT COUNT(*) FROM (
    SELECT name, item, price FROM dl.customer_purchases
    EXCEPT ALL
    SELECT c.name, p.item, p.price FROM dl.customers c INNER JOIN dl.purchases p ON c.id = p.cust_id
);
----
0

# INSERT on left side (customers) — new customer with existing purchase match
statement ok
INSERT INTO dl.customers VALUES (4, 'Diana');

statement ok
INSERT INTO dl.purchases VALUES (4, 'Thingamajig', 15);

statement ok
PRAGMA refresh('customer_purchases');

query I
SELECT COUNT(*) FROM (
    SELECT c.name, p.item, p.price FROM dl.customers c INNER JOIN dl.purchases p ON c.id = p.cust_id
    EXCEPT ALL
    SELECT name, item, price FROM dl.customer_purchases
);
----
0

query I
SELECT COUNT(*) FROM (
    SELECT name, item, price FROM dl.customer_purchases
    EXCEPT ALL
    SELECT c.name, p.item, p.price FROM dl.customers c INNER JOIN dl.purchases p ON c.id = p.cust_id
);
----
0

# ==========================================
# Test 2: Aggregate over join (SUM + COUNT + GROUP BY)
# ==========================================

statement ok
CREATE TABLE dl.products (pid INT, pname VARCHAR);

statement ok
CREATE TABLE dl.sales (pid INT, qty INT, revenue INT);

statement ok
INSERT INTO dl.products VALUES (1, 'Alpha'), (2, 'Beta'), (3, 'Gamma');

statement ok
INSERT INTO dl.sales VALUES (1, 10, 100), (1, 5, 50), (2, 20, 400);

statement ok
CREATE MATERIALIZED VIEW dl.product_summary AS
    SELECT p.pname, SUM(s.revenue) AS total_rev, COUNT(*) AS sale_count
    FROM dl.products p INNER JOIN dl.sales s ON p.pid = s.pid
    GROUP BY p.pname;

statement ok
PRAGMA refresh('product_summary');

# Cross-check after initial load
query I
SELECT COUNT(*) FROM (
    SELECT p.pname, SUM(s.revenue), COUNT(*)
    FROM dl.products p INNER JOIN dl.sales s ON p.pid = s.pid GROUP BY p.pname
    EXCEPT ALL
    SELECT pname, total_rev, sale_count FROM dl.product_summary
);
----
0

# ==========================================
# Test 7: Projection-key refresh over a self-join
# ==========================================

statement ok
CREATE TABLE dl.pk_holdings(trade_id INT, previous_trade_id INT, account_id INT, symbol VARCHAR, qty INT);

statement ok
CREATE TABLE dl.pk_trades(sk_trade_id INT, trade_id INT);

statement ok
CREATE TABLE dl.pk_accounts(account_id INT, sk_customer_id INT);

statement ok
CREATE TABLE dl.pk_securities(symbol VARCHAR, sk_security_id INT);

statement ok
INSERT INTO dl.pk_trades VALUES (100, 10), (200, 20), (300, 30);

statement ok
INSERT INTO dl.pk_accounts VALUES (1, 1000), (2, 2000);

statement ok
INSERT INTO dl.pk_securities VALUES ('A', 500), ('B', 600);

statement ok
INSERT INTO dl.pk_holdings VALUES (10, 20, 1, 'A', 5), (30, 20, 2, 'B', 9);

statement ok
CREATE MATERIALIZED VIEW dl.projection_key_holdings AS
    SELECT
        ct.sk_trade_id AS sk_current_trade_id,
        pt.sk_trade_id AS prev_sk_trade_id,
        a.sk_customer_id,
        s.sk_security_id,
        h.qty
    FROM dl.pk_holdings h
    JOIN dl.pk_trades ct ON h.trade_id = ct.trade_id
    JOIN dl.pk_trades pt ON h.previous_trade_id = pt.trade_id
    JOIN dl.pk_accounts a ON h.account_id = a.account_id
    JOIN dl.pk_securities s ON h.symbol = s.symbol;

query I
SELECT window_partition_lineage_json LIKE '{"kind":"projection_key"%' FROM openivm_views WHERE view_name = 'projection_key_holdings';
----
true

statement ok
SET openivm_profile_refresh = true;

# Exercise the direct source, the repeated pk_trades source through the previous-trade alias,
# and a dimension lookup. The affected-key path may over-include keys, but it must not miss any.
statement ok
UPDATE dl.pk_trades SET sk_trade_id = 201 WHERE trade_id = 20;

statement ok
UPDATE dl.pk_accounts SET sk_customer_id = 1001 WHERE account_id = 1;

statement ok
INSERT INTO dl.pk_holdings VALUES (10, 20, 1, 'A', 6);

statement ok
PRAGMA refresh('projection_key_holdings');

query I
SELECT COUNT(*) FROM (
    SELECT
        ct.sk_trade_id AS sk_current_trade_id,
        pt.sk_trade_id AS prev_sk_trade_id,
        a.sk_customer_id,
        s.sk_security_id,
        h.qty
    FROM dl.pk_holdings h
    JOIN dl.pk_trades ct ON h.trade_id = ct.trade_id
    JOIN dl.pk_trades pt ON h.previous_trade_id = pt.trade_id
    JOIN dl.pk_accounts a ON h.account_id = a.account_id
    JOIN dl.pk_securities s ON h.symbol = s.symbol
    EXCEPT ALL
    SELECT sk_current_trade_id, prev_sk_trade_id, sk_customer_id, sk_security_id, qty FROM dl.projection_key_holdings
);
----
0

query I
SELECT COUNT(*) FROM (
    SELECT sk_current_trade_id, prev_sk_trade_id, sk_customer_id, sk_security_id, qty FROM dl.projection_key_holdings
    EXCEPT ALL
    SELECT
        ct.sk_trade_id AS sk_current_trade_id,
        pt.sk_trade_id AS prev_sk_trade_id,
        a.sk_customer_id,
        s.sk_security_id,
        h.qty
    FROM dl.pk_holdings h
    JOIN dl.pk_trades ct ON h.trade_id = ct.trade_id
    JOIN dl.pk_trades pt ON h.previous_trade_id = pt.trade_id
    JOIN dl.pk_accounts a ON h.account_id = a.account_id
    JOIN dl.pk_securities s ON h.symbol = s.symbol
);
----
0

# Changing the output key itself must delete the old key partition and insert the new one.
statement ok
UPDATE dl.pk_trades SET sk_trade_id = 101 WHERE trade_id = 10;

statement ok
PRAGMA refresh('projection_key_holdings');

query I
SELECT COUNT(*) FROM (
    SELECT
        ct.sk_trade_id AS sk_current_trade_id,
        pt.sk_trade_id AS prev_sk_trade_id,
        a.sk_customer_id,
        s.sk_security_id,
        h.qty
    FROM dl.pk_holdings h
    JOIN dl.pk_trades ct ON h.trade_id = ct.trade_id
    JOIN dl.pk_trades pt ON h.previous_trade_id = pt.trade_id
    JOIN dl.pk_accounts a ON h.account_id = a.account_id
    JOIN dl.pk_securities s ON h.symbol = s.symbol
    EXCEPT ALL
    SELECT sk_current_trade_id, prev_sk_trade_id, sk_customer_id, sk_security_id, qty FROM dl.projection_key_holdings
);
----
0

query I
SELECT COUNT(*) FROM (
    SELECT sk_current_trade_id, prev_sk_trade_id, sk_customer_id, sk_security_id, qty FROM dl.projection_key_holdings
    EXCEPT ALL
    SELECT
        ct.sk_trade_id AS sk_current_trade_id,
        pt.sk_trade_id AS prev_sk_trade_id,
        a.sk_customer_id,
        s.sk_security_id,
        h.qty
    FROM dl.pk_holdings h
    JOIN dl.pk_trades ct ON h.trade_id = ct.trade_id
    JOIN dl.pk_trades pt ON h.previous_trade_id = pt.trade_id
    JOIN dl.pk_accounts a ON h.account_id = a.account_id
    JOIN dl.pk_securities s ON h.symbol = s.symbol
);
----
0

query I
SELECT count(*) FROM openivm_refresh_profile
WHERE view_name = 'projection_key_holdings'
  AND step_name = 'execute_refresh_sql_stmt'
  AND detail LIKE '%ComputeDelta%';
----
0

query I
SELECT COUNT(*) FROM (
    SELECT pname, total_rev, sale_count FROM dl.product_summary
    EXCEPT ALL
    SELECT p.pname, SUM(s.revenue), COUNT(*)
    FROM dl.products p INNER JOIN dl.sales s ON p.pid = s.pid GROUP BY p.pname
);
----
0

# Add sales for existing product + new product with sales
statement ok
INSERT INTO dl.sales VALUES (2, 3, 60), (3, 7, 140);

statement ok
PRAGMA refresh('product_summary');

query I
SELECT COUNT(*) FROM (
    SELECT p.pname, SUM(s.revenue), COUNT(*)
    FROM dl.products p INNER JOIN dl.sales s ON p.pid = s.pid GROUP BY p.pname
    EXCEPT ALL
    SELECT pname, total_rev, sale_count FROM dl.product_summary
);
----
0

query I
SELECT COUNT(*) FROM (
    SELECT pname, total_rev, sale_count FROM dl.product_summary
    EXCEPT ALL
    SELECT p.pname, SUM(s.revenue), COUNT(*)
    FROM dl.products p INNER JOIN dl.sales s ON p.pid = s.pid GROUP BY p.pname
);
----
0

# Delete a sale row — group total should adjust
statement ok
DELETE FROM dl.sales WHERE pid = 1 AND qty = 10;

statement ok
PRAGMA refresh('product_summary');

query I
SELECT COUNT(*) FROM (
    SELECT p.pname, SUM(s.revenue), COUNT(*)
    FROM dl.products p INNER JOIN dl.sales s ON p.pid = s.pid GROUP BY p.pname
    EXCEPT ALL
    SELECT pname, total_rev, sale_count FROM dl.product_summary
);
----
0

query I
SELECT COUNT(*) FROM (
    SELECT pname, total_rev, sale_count FROM dl.product_summary
    EXCEPT ALL
    SELECT p.pname, SUM(s.revenue), COUNT(*)
    FROM dl.products p INNER JOIN dl.sales s ON p.pid = s.pid GROUP BY p.pname
);
----
0

# ==========================================
# Test 3: Stress — batch INSERT into both tables + DELETE before single refresh
# ==========================================

statement ok
CREATE TABLE dl.departments (did INT, dname VARCHAR);

statement ok
CREATE TABLE dl.employees (eid INT, did INT, salary INT);

statement ok
INSERT INTO dl.departments VALUES (1, 'Engineering'), (2, 'Sales'), (3, 'Marketing');

statement ok
INSERT INTO dl.employees VALUES (1, 1, 100), (2, 1, 200), (3, 2, 150), (4, 2, 300), (5, 3, 80);

statement ok
CREATE MATERIALIZED VIEW dl.dept_roster AS
    SELECT d.dname, e.eid, e.salary
    FROM dl.departments d INNER JOIN dl.employees e ON d.did = e.did;

statement ok
PRAGMA refresh('dept_roster');

# Cross-check after initial load
query I
SELECT COUNT(*) FROM (
    SELECT d.dname, e.eid, e.salary FROM dl.departments d INNER JOIN dl.employees e ON d.did = e.did
    EXCEPT ALL
    SELECT dname, eid, salary FROM dl.dept_roster
);
----
0

query I
SELECT COUNT(*) FROM (
    SELECT dname, eid, salary FROM dl.dept_roster
    EXCEPT ALL
    SELECT d.dname, e.eid, e.salary FROM dl.departments d INNER JOIN dl.employees e ON d.did = e.did
);
----
0

# Batch: INSERT into both tables, DELETE from both, conflicting ops
# Add new department + employees for it
statement ok
INSERT INTO dl.departments VALUES (4, 'Legal');

statement ok
INSERT INTO dl.employees VALUES (6, 4, 250), (7, 4, 300);

# Add more employees to existing departments
statement ok
INSERT INTO dl.employees VALUES (8, 1, 500), (9, 2, 175);

# Delete employees from existing departments (some in MV)
statement ok
DELETE FROM dl.employees WHERE eid = 2;

statement ok
DELETE FROM dl.employees WHERE eid = 3;

# Delete a department that has employees (cascading removal from MV)
statement ok
DELETE FROM dl.departments WHERE did = 3;

# Insert employee for deleted department (no join match, should not appear)
statement ok
INSERT INTO dl.employees VALUES (10, 3, 999);

# Insert and then delete same new employee (net zero for eid=11)
statement ok
INSERT INTO dl.employees VALUES (11, 1, 50);

statement ok
DELETE FROM dl.employees WHERE eid = 11;

# Single refresh after all batched operations
statement ok
PRAGMA refresh('dept_roster');

query I
SELECT COUNT(*) FROM (
    SELECT d.dname, e.eid, e.salary FROM dl.departments d INNER JOIN dl.employees e ON d.did = e.did
    EXCEPT ALL
    SELECT dname, eid, salary FROM dl.dept_roster
);
----
0

query I
SELECT COUNT(*) FROM (
    SELECT dname, eid, salary FROM dl.dept_roster
    EXCEPT ALL
    SELECT d.dname, e.eid, e.salary FROM dl.departments d INNER JOIN dl.employees e ON d.did = e.did
);
----
0

# ==========================================
# Test 4: Empty delta — refresh with no changes (all terms should be skipped)
# ==========================================

# Refresh immediately after last refresh — all deltas empty, should be a no-op
statement ok
PRAGMA refresh('dept_roster');

# MV should be unchanged
query I
SELECT COUNT(*) FROM (
    SELECT d.dname, e.eid, e.salary FROM dl.departments d INNER JOIN dl.employees e ON d.did = e.did
    EXCEPT ALL
    SELECT dname, eid, salary FROM dl.dept_roster
);
----
0

# Also test empty delta on aggregate join view
statement ok
PRAGMA refresh('product_summary');

query I
SELECT COUNT(*) FROM (
    SELECT p.pname, SUM(s.revenue), COUNT(*)
    FROM dl.products p INNER JOIN dl.sales s ON p.pid = s.pid GROUP BY p.pname
    EXCEPT ALL
    SELECT pname, total_rev, sale_count FROM dl.product_summary
);
----
0

# Multiple consecutive no-op refreshes should be safe
statement ok
PRAGMA refresh('customer_purchases');

statement ok
PRAGMA refresh('customer_purchases');

statement ok
PRAGMA refresh('customer_purchases');

query I
SELECT COUNT(*) FROM (
    SELECT c.name, p.item, p.price FROM dl.customers c INNER JOIN dl.purchases p ON c.id = p.cust_id
    EXCEPT ALL
    SELECT name, item, price FROM dl.customer_purchases
);
----
0

# ==========================================
# Test 5: Partial empty delta — only one table changes in a 2-table join
# ==========================================

# Insert only into purchases (customers unchanged — its term should be skipped)
statement ok
INSERT INTO dl.purchases VALUES (2, 'Sprocket', 30);

statement ok
PRAGMA refresh('customer_purchases');

query I
SELECT COUNT(*) FROM (
    SELECT c.name, p.item, p.price FROM dl.customers c INNER JOIN dl.purchases p ON c.id = p.cust_id
    EXCEPT ALL
    SELECT name, item, price FROM dl.customer_purchases
);
----
0

query I
SELECT COUNT(*) FROM (
    SELECT name, item, price FROM dl.customer_purchases
    EXCEPT ALL
    SELECT c.name, p.item, p.price FROM dl.customers c INNER JOIN dl.purchases p ON c.id = p.cust_id
);
----
0

# Insert only into customers (purchases unchanged), new customer with no purchases
statement ok
INSERT INTO dl.customers VALUES (5, 'Eve');

statement ok
PRAGMA refresh('customer_purchases');

query I
SELECT COUNT(*) FROM (
    SELECT c.name, p.item, p.price FROM dl.customers c INNER JOIN dl.purchases p ON c.id = p.cust_id
    EXCEPT ALL
    SELECT name, item, price FROM dl.customer_purchases
);
----
0

query I
SELECT COUNT(*) FROM (
    SELECT name, item, price FROM dl.customer_purchases
    EXCEPT ALL
    SELECT c.name, p.item, p.price FROM dl.customers c INNER JOIN dl.purchases p ON c.id = p.cust_id
);
----
0

# ==========================================
# Test 6: Cost model for DuckLake joins
# ==========================================

# After refresh, deltas are empty — IVM cost should be 0, decision = incremental
statement ok
PRAGMA refresh_cost('product_summary');

# Insert data into one table, verify cost model doesn't error with DuckLake delta cardinality
statement ok
INSERT INTO dl.sales VALUES (3, 1, 999);

statement ok
PRAGMA refresh_cost('product_summary');

# Refresh to apply the delta
statement ok
PRAGMA refresh('product_summary');

query I
SELECT COUNT(*) FROM (
    SELECT p.pname, SUM(s.revenue), COUNT(*)
    FROM dl.products p INNER JOIN dl.sales s ON p.pid = s.pid GROUP BY p.pname
    EXCEPT ALL
    SELECT pname, total_rev, sale_count FROM dl.product_summary
);
----
0
