# name: test/sql/ducklake_projection.test
# description: Test IVM projections with DuckLake base tables
# group: [sql]

require openivm

require parquet

statement ok
INSTALL ducklake;

statement ok
LOAD ducklake;

statement ok
ATTACH '__TEST_DIR__/ducklake_projection.db' AS dl (TYPE ducklake);

# ==========================================
# 1. Simple SELECT projection
# ==========================================

statement ok
CREATE TABLE dl.employees (id INT, name VARCHAR, dept VARCHAR);

statement ok
INSERT INTO dl.employees VALUES (1, 'Alice', 'eng'), (2, 'Bob', 'sales'), (3, 'Charlie', 'eng');

statement ok
CREATE MATERIALIZED VIEW dl.mv_emp AS SELECT id, name FROM dl.employees;

statement ok
SET openivm_profile_refresh = true;

# --- INSERT propagation ---
statement ok
INSERT INTO dl.employees VALUES (4, 'Diana', 'ops');

statement ok
PRAGMA refresh('mv_emp');

query I
SELECT count(*) FROM openivm_refresh_profile WHERE view_name = 'mv_emp' AND step_name IN ('metadata_pre_sql', 'metadata_post_sql');
----
2

query I
SELECT count(*) FROM openivm_refresh_profile WHERE view_name = 'mv_emp' AND step_name IN ('generate_refresh_sql', 'execute_refresh_sql', 'total_refresh') AND duration_ms >= 0;
----
3

query I
SELECT COUNT(*) FROM (
    SELECT id, name FROM dl.employees
    EXCEPT ALL
    SELECT id, name FROM dl.mv_emp
);
----
0

query I
SELECT COUNT(*) FROM (
    SELECT id, name FROM dl.mv_emp
    EXCEPT ALL
    SELECT id, name FROM dl.employees
);
----
0

# --- DELETE propagation ---
statement ok
DELETE FROM dl.employees WHERE id = 2;

statement ok
PRAGMA refresh('mv_emp');

query I
SELECT count(DISTINCT refresh_id) FROM openivm_refresh_profile WHERE view_name = 'mv_emp';
----
2

statement ok
SET openivm_profile_refresh = false;

query I
SELECT COUNT(*) FROM (
    SELECT id, name FROM dl.employees
    EXCEPT ALL
    SELECT id, name FROM dl.mv_emp
);
----
0

query I
SELECT COUNT(*) FROM (
    SELECT id, name FROM dl.mv_emp
    EXCEPT ALL
    SELECT id, name FROM dl.employees
);
----
0

# ==========================================
# 2. Multi-column projection with expressions
# ==========================================

statement ok
CREATE TABLE dl.products (id INT, name VARCHAR, price DOUBLE, qty INT);

statement ok
INSERT INTO dl.products VALUES (1, 'Widget', 9.99, 100), (2, 'Gadget', 24.50, 50);

statement ok
CREATE MATERIALIZED VIEW dl.mv_prod AS
    SELECT name, price * qty AS total_value, qty > 75 AS high_stock FROM dl.products;

statement ok
INSERT INTO dl.products VALUES (3, 'Gizmo', 5.00, 200);

statement ok
DELETE FROM dl.products WHERE id = 1;

statement ok
PRAGMA refresh('mv_prod');

query I
SELECT COUNT(*) FROM (
    SELECT name, price * qty AS total_value, qty > 75 AS high_stock FROM dl.products
    EXCEPT ALL
    SELECT name, total_value, high_stock FROM dl.mv_prod
);
----
0

query I
SELECT COUNT(*) FROM (
    SELECT name, total_value, high_stock FROM dl.mv_prod
    EXCEPT ALL
    SELECT name, price * qty AS total_value, qty > 75 AS high_stock FROM dl.products
);
----
0

# UPDATE a product and refresh
statement ok
UPDATE dl.products SET price = 30.00 WHERE id = 2;

statement ok
PRAGMA refresh('mv_prod');

query I
SELECT COUNT(*) FROM (
    SELECT name, price * qty AS total_value, qty > 75 AS high_stock FROM dl.products
    EXCEPT ALL
    SELECT name, total_value, high_stock FROM dl.mv_prod
);
----
0

query I
SELECT COUNT(*) FROM (
    SELECT name, total_value, high_stock FROM dl.mv_prod
    EXCEPT ALL
    SELECT name, price * qty AS total_value, qty > 75 AS high_stock FROM dl.products
);
----
0

# ==========================================
# 3. Stress test: batch INSERT + DELETE + UPDATE before single refresh
# ==========================================

statement ok
CREATE TABLE dl.stress (id INT, val VARCHAR);

statement ok
INSERT INTO dl.stress VALUES (1, 'a'), (1, 'a'), (2, 'b'), (3, 'c');

statement ok
CREATE MATERIALIZED VIEW dl.mv_stress AS SELECT id, val FROM dl.stress;

# --- Round 1: Mixed INSERT + DELETE + UPDATE, single refresh ---
statement ok
INSERT INTO dl.stress VALUES (4, 'd'), (4, 'd'), (5, 'e');

statement ok
DELETE FROM dl.stress WHERE id = 2;

statement ok
UPDATE dl.stress SET val = 'A' WHERE id = 1;

statement ok
PRAGMA refresh('mv_stress');

query I
SELECT COUNT(*) FROM (
    SELECT id, val FROM dl.stress
    EXCEPT ALL
    SELECT id, val FROM dl.mv_stress
);
----
0

query I
SELECT COUNT(*) FROM (
    SELECT id, val FROM dl.mv_stress
    EXCEPT ALL
    SELECT id, val FROM dl.stress
);
----
0

# --- Round 2: Insert + delete same rows (net zero) alongside real changes ---
statement ok
INSERT INTO dl.stress VALUES (99, 'ghost'), (99, 'ghost');

statement ok
DELETE FROM dl.stress WHERE id = 99;

statement ok
INSERT INTO dl.stress VALUES (6, 'f');

statement ok
DELETE FROM dl.stress WHERE id = 3;

statement ok
PRAGMA refresh('mv_stress');

query I
SELECT COUNT(*) FROM (
    SELECT id, val FROM dl.stress
    EXCEPT ALL
    SELECT id, val FROM dl.mv_stress
);
----
0

query I
SELECT COUNT(*) FROM (
    SELECT id, val FROM dl.mv_stress
    EXCEPT ALL
    SELECT id, val FROM dl.stress
);
----
0

# --- Round 3: Conflicting ops on same row ---
statement ok
INSERT INTO dl.stress VALUES (30, 'x'), (30, 'x'), (30, 'x');

statement ok
DELETE FROM dl.stress WHERE id = 30;

statement ok
INSERT INTO dl.stress VALUES (30, 'y');

statement ok
UPDATE dl.stress SET val = 'z' WHERE id = 30;

statement ok
INSERT INTO dl.stress VALUES (30, 'z');

statement ok
PRAGMA refresh('mv_stress');

query I
SELECT COUNT(*) FROM (
    SELECT id, val FROM dl.stress
    EXCEPT ALL
    SELECT id, val FROM dl.mv_stress
);
----
0

query I
SELECT COUNT(*) FROM (
    SELECT id, val FROM dl.mv_stress
    EXCEPT ALL
    SELECT id, val FROM dl.stress
);
----
0

# --- Round 4: Delete everything, refresh, re-insert ---
statement ok
DELETE FROM dl.stress;

statement ok
PRAGMA refresh('mv_stress');

query I
SELECT COUNT(*) FROM dl.mv_stress;
----
0

query I
SELECT COUNT(*) FROM (
    SELECT id, val FROM dl.stress
    EXCEPT ALL
    SELECT id, val FROM dl.mv_stress
);
----
0

statement ok
INSERT INTO dl.stress VALUES (10, 'new'), (10, 'new'), (11, 'also');

statement ok
PRAGMA refresh('mv_stress');

query I
SELECT COUNT(*) FROM (
    SELECT id, val FROM dl.stress
    EXCEPT ALL
    SELECT id, val FROM dl.mv_stress
);
----
0

query I
SELECT COUNT(*) FROM (
    SELECT id, val FROM dl.mv_stress
    EXCEPT ALL
    SELECT id, val FROM dl.stress
);
----
0

# --- Round 5: No-op refresh (no changes) ---
statement ok
PRAGMA refresh('mv_stress');

query I
SELECT COUNT(*) FROM (
    SELECT id, val FROM dl.stress
    EXCEPT ALL
    SELECT id, val FROM dl.mv_stress
);
----
0

query I
SELECT COUNT(*) FROM (
    SELECT id, val FROM dl.mv_stress
    EXCEPT ALL
    SELECT id, val FROM dl.stress
);
----
0

# ==========================================
# Projection top-k: ORDER BY + LIMIT without GROUP BY
# ==========================================

statement ok
CREATE TABLE dl.topkp (id INT, name VARCHAR, score INT);

statement ok
INSERT INTO dl.topkp VALUES
    (1,'alice',80),(2,'bob',95),(3,'carol',70),(4,'dave',88),(5,'eve',92);

statement ok
CREATE MATERIALIZED VIEW dl.topkp_mv AS
    SELECT id, name, score FROM dl.topkp ORDER BY score DESC LIMIT 3;

statement ok
PRAGMA refresh('topkp_mv');

query I
SELECT COUNT(*) FROM (
    SELECT id, name, score FROM dl.topkp_mv
    EXCEPT ALL
    SELECT * FROM (SELECT id, name, score FROM dl.topkp ORDER BY score DESC LIMIT 3) _q
);
----
0

query I
SELECT COUNT(*) FROM (
    SELECT * FROM (SELECT id, name, score FROM dl.topkp ORDER BY score DESC LIMIT 3) _q
    EXCEPT ALL
    SELECT id, name, score FROM dl.topkp_mv
);
----
0

# ==========================================
# 6. DuckLake catalog names are not hardcoded to dl
# ==========================================

statement ok
ATTACH '__TEST_DIR__/ducklake_projection_alt.db' AS lakecat (TYPE ducklake);

statement ok
CREATE TABLE lakecat.alt_src (id INT, name VARCHAR);

statement ok
INSERT INTO lakecat.alt_src VALUES (1, 'one'), (2, 'two');

statement ok
CREATE MATERIALIZED VIEW lakecat.alt_mv AS SELECT id, name FROM lakecat.alt_src;

query I
SELECT count(*) FROM information_schema.tables
WHERE table_catalog = 'lakecat'
  AND table_schema = 'main'
  AND table_name IN ('openivm_data_alt_mv', 'openivm_delta_alt_mv');
----
2

query I
SELECT count(*) FROM openivm_delta_tables
WHERE view_name = 'alt_mv'
  AND table_name = 'alt_src'
  AND source_catalog = 'lakecat';
----
1

statement ok
INSERT INTO lakecat.alt_src VALUES (3, 'three');

statement ok
PRAGMA refresh_options('lakecat', 'main', 'alt_mv');

query I
SELECT COUNT(*) FROM (
    SELECT id, name FROM lakecat.alt_src
    EXCEPT ALL
    SELECT id, name FROM lakecat.alt_mv
);
----
0

query I
SELECT COUNT(*) FROM (
    SELECT id, name FROM lakecat.alt_mv
    EXCEPT ALL
    SELECT id, name FROM lakecat.alt_src
);
----
0

statement ok
USE lakecat.main;

statement ok
CREATE MATERIALIZED VIEW alt_mv_from_use AS SELECT id, name FROM alt_src;

statement ok
USE memory.main;

query I
SELECT count(*) FROM information_schema.tables
WHERE table_catalog = 'lakecat'
  AND table_schema = 'main'
  AND table_name IN ('openivm_data_alt_mv_from_use', 'openivm_delta_alt_mv_from_use');
----
2

query I
SELECT count(*) FROM openivm_delta_tables
WHERE view_name = 'alt_mv_from_use'
  AND table_name = 'alt_src'
  AND source_catalog = 'lakecat';
----
1

statement ok
INSERT INTO lakecat.alt_src VALUES (4, 'four');

statement ok
PRAGMA refresh_options('lakecat', 'main', 'alt_mv_from_use');

query I
SELECT COUNT(*) FROM (
    SELECT id, name FROM lakecat.alt_src
    EXCEPT ALL
    SELECT id, name FROM lakecat.alt_mv_from_use
);
----
0

query I
SELECT COUNT(*) FROM (
    SELECT id, name FROM lakecat.alt_mv_from_use
    EXCEPT ALL
    SELECT id, name FROM lakecat.alt_src
);
----
0

statement ok
ATTACH '__TEST_DIR__/ducklake_projection_alt2.db' AS lakecat2 (TYPE ducklake);

statement ok
CREATE TABLE lakecat.cat_a (id INT, v INT);

statement ok
CREATE TABLE lakecat2.cat_b (id INT, label VARCHAR);

statement ok
INSERT INTO lakecat.cat_a VALUES (1, 10), (2, 20);

statement ok
INSERT INTO lakecat2.cat_b VALUES (1, 'one'), (2, 'two');

statement ok
CREATE MATERIALIZED VIEW lakecat.mv_two_catalogs AS
SELECT a.id, a.v, b.label
FROM lakecat.cat_a a
JOIN lakecat2.cat_b b USING (id);

query I
SELECT count(*) FROM information_schema.tables
WHERE table_catalog = 'lakecat'
  AND table_schema = 'main'
  AND table_name IN ('openivm_data_mv_two_catalogs', 'openivm_delta_mv_two_catalogs');
----
2

query II rowsort
SELECT table_name, source_catalog
FROM openivm_delta_tables
WHERE view_name = 'mv_two_catalogs'
ORDER BY table_name;
----
cat_a	lakecat
cat_b	lakecat2

statement ok
INSERT INTO lakecat.cat_a VALUES (3, 30);

statement ok
INSERT INTO lakecat2.cat_b VALUES (3, 'three');

statement ok
PRAGMA refresh_options('lakecat', 'main', 'mv_two_catalogs');

query I
SELECT COUNT(*) FROM (
    SELECT a.id, a.v, b.label FROM lakecat.cat_a a JOIN lakecat2.cat_b b USING (id)
    EXCEPT ALL
    SELECT id, v, label FROM lakecat.mv_two_catalogs
);
----
0

query I
SELECT COUNT(*) FROM (
    SELECT id, v, label FROM lakecat.mv_two_catalogs
    EXCEPT ALL
    SELECT a.id, a.v, b.label FROM lakecat.cat_a a JOIN lakecat2.cat_b b USING (id)
);
----
0

statement ok
CREATE MATERIALIZED VIEW lakecat2.mv_two_catalogs_inverse AS
SELECT a.id, a.v, b.label
FROM lakecat.cat_a a
JOIN lakecat2.cat_b b USING (id);

query I
SELECT count(*) FROM information_schema.tables
WHERE table_catalog = 'lakecat2'
  AND table_schema = 'main'
  AND table_name IN ('openivm_data_mv_two_catalogs_inverse', 'openivm_delta_mv_two_catalogs_inverse');
----
2

query I
SELECT count(*) FROM information_schema.tables
WHERE table_catalog = 'lakecat'
  AND table_schema = 'main'
  AND table_name IN ('openivm_data_mv_two_catalogs_inverse', 'openivm_delta_mv_two_catalogs_inverse');
----
0

statement ok
INSERT INTO lakecat.cat_a VALUES (4, 40);

statement ok
INSERT INTO lakecat2.cat_b VALUES (4, 'four');

statement ok
PRAGMA refresh_options('lakecat2', 'main', 'mv_two_catalogs_inverse');

query I
SELECT COUNT(*) FROM (
    SELECT a.id, a.v, b.label FROM lakecat.cat_a a JOIN lakecat2.cat_b b USING (id)
    EXCEPT ALL
    SELECT id, v, label FROM lakecat2.mv_two_catalogs_inverse
);
----
0

query I
SELECT COUNT(*) FROM (
    SELECT id, v, label FROM lakecat2.mv_two_catalogs_inverse
    EXCEPT ALL
    SELECT a.id, a.v, b.label FROM lakecat.cat_a a JOIN lakecat2.cat_b b USING (id)
);
----
0

statement ok
USE lakecat2.main;

statement ok
CREATE MATERIALIZED VIEW mv_two_catalogs_from_use AS
SELECT a.id, a.v, b.label
FROM lakecat.cat_a a
JOIN cat_b b USING (id);

statement ok
USE memory.main;

query I
SELECT count(*) FROM information_schema.tables
WHERE table_catalog = 'lakecat2'
  AND table_schema = 'main'
  AND table_name IN ('openivm_data_mv_two_catalogs_from_use', 'openivm_delta_mv_two_catalogs_from_use');
----
2

statement ok
INSERT INTO lakecat.cat_a VALUES (5, 50);

statement ok
INSERT INTO lakecat2.cat_b VALUES (5, 'five');

statement ok
PRAGMA refresh_options('lakecat2', 'main', 'mv_two_catalogs_from_use');

query I
SELECT COUNT(*) FROM (
    SELECT a.id, a.v, b.label FROM lakecat.cat_a a JOIN lakecat2.cat_b b USING (id)
    EXCEPT ALL
    SELECT id, v, label FROM lakecat2.mv_two_catalogs_from_use
);
----
0

query I
SELECT COUNT(*) FROM (
    SELECT id, v, label FROM lakecat2.mv_two_catalogs_from_use
    EXCEPT ALL
    SELECT a.id, a.v, b.label FROM lakecat.cat_a a JOIN lakecat2.cat_b b USING (id)
);
----
0

# ==========================================
# DuckLake projection over VALUES join
# ==========================================

statement ok
CREATE TABLE dl.value_customers (id INTEGER, credit VARCHAR, last_name VARCHAR);

statement ok
INSERT INTO dl.value_customers VALUES (1, 'GC', 'Able'), (2, 'BC', 'Baker'), (3, 'XX', 'Cross');

statement ok
CREATE MATERIALIZED VIEW dl.mv_value_join AS
    SELECT c.id, c.last_name, v.priority
    FROM dl.value_customers c
    JOIN (VALUES ('GC', 1), ('BC', 2)) AS v(credit, priority)
      ON c.credit = v.credit;

query I
SELECT type FROM openivm_views WHERE view_name = 'mv_value_join';
----
2

statement ok
UPDATE dl.value_customers SET credit = 'GC' WHERE id = 3;

statement ok
PRAGMA refresh('mv_value_join');

query I
SELECT COUNT(*) FROM (
    SELECT id, last_name, priority FROM dl.mv_value_join
    EXCEPT ALL
    SELECT c.id, c.last_name, v.priority
    FROM dl.value_customers c
    JOIN (VALUES ('GC', 1), ('BC', 2)) AS v(credit, priority)
      ON c.credit = v.credit
);
----
0

query I
SELECT COUNT(*) FROM (
    SELECT c.id, c.last_name, v.priority
    FROM dl.value_customers c
    JOIN (VALUES ('GC', 1), ('BC', 2)) AS v(credit, priority)
      ON c.credit = v.credit
    EXCEPT ALL
    SELECT id, last_name, priority FROM dl.mv_value_join
);
----
0

# Insert a new top scorer (frank=99 enters top-3)
statement ok
INSERT INTO dl.topkp VALUES (6,'frank',99);

statement ok
PRAGMA refresh('topkp_mv');

query I
SELECT COUNT(*) FROM (
    SELECT id, name, score FROM dl.topkp_mv
    EXCEPT ALL
    SELECT * FROM (SELECT id, name, score FROM dl.topkp ORDER BY score DESC LIMIT 3) _q
);
----
0

query I
SELECT COUNT(*) FROM (
    SELECT * FROM (SELECT id, name, score FROM dl.topkp ORDER BY score DESC LIMIT 3) _q
    EXCEPT ALL
    SELECT id, name, score FROM dl.topkp_mv
);
----
0

# Stress: conflicting INSERT + DELETE + UPDATE before single refresh
statement ok
INSERT INTO dl.topkp VALUES (7,'grace',100),(8,'heidi',60);

statement ok
DELETE FROM dl.topkp WHERE id = 6;

statement ok
UPDATE dl.topkp SET score = 50 WHERE id = 2;

statement ok
PRAGMA refresh('topkp_mv');

query I
SELECT COUNT(*) FROM (
    SELECT id, name, score FROM dl.topkp_mv
    EXCEPT ALL
    SELECT * FROM (SELECT id, name, score FROM dl.topkp ORDER BY score DESC LIMIT 3) _q
);
----
0

query I
SELECT COUNT(*) FROM (
    SELECT * FROM (SELECT id, name, score FROM dl.topkp ORDER BY score DESC LIMIT 3) _q
    EXCEPT ALL
    SELECT id, name, score FROM dl.topkp_mv
);
----
0
