# name: test/sql/ducklake_window.test
# description: Test DuckLake window partition refresh uses the exposed partition output column
# group: [sql]

require openivm

require parquet

statement ok
INSTALL ducklake;

statement ok
LOAD ducklake;

statement ok
ATTACH '__TEST_DIR__/ducklake_window.db' AS dl (TYPE ducklake);

statement ok
CREATE TABLE dl.history_win (
    H_C_ID INT,
    H_C_D_ID INT,
    H_C_W_ID INT,
    H_D_ID INT,
    H_W_ID INT,
    H_DATE TIMESTAMP,
    H_AMOUNT DECIMAL(6, 2),
    H_DATA VARCHAR
);

statement ok
CREATE MATERIALIZED VIEW dl.mv_history_window AS
SELECT
    H_W_ID,
    H_D_ID,
    H_C_ID,
    H_AMOUNT,
    SUM(H_AMOUNT) OVER (PARTITION BY H_W_ID) AS w_total,
    H_AMOUNT / NULLIF(SUM(H_AMOUNT) OVER (PARTITION BY H_W_ID), 0) AS share
FROM dl.history_win
WHERE H_AMOUNT > 0;

# The partition source column is the fifth source column, but it is the first MV
# output column. Refresh must filter affected partitions on H_W_ID, not H_D_ID.
query I
SELECT group_columns FROM openivm_views WHERE view_name = 'mv_history_window';
----
H_W_ID=H_W_ID

statement ok
INSERT INTO dl.history_win VALUES
    (4, 8, 3, 8, 3, '2026-01-01 00:00:00', 469.00, 'Payment'),
    (28, 10, 1, 10, 1, '2026-01-01 00:00:00', 316.00, 'Payment'),
    (22, 4, 2, 4, 2, '2026-01-01 00:00:00', 267.00, 'Payment');

statement ok
PRAGMA refresh('mv_history_window');

query I
SELECT count(*) FROM dl.mv_history_window;
----
3

query I
SELECT count(*) FROM (
    SELECT * FROM dl.mv_history_window
    EXCEPT ALL
    SELECT
        H_W_ID,
        H_D_ID,
        H_C_ID,
        H_AMOUNT,
        SUM(H_AMOUNT) OVER (PARTITION BY H_W_ID) AS w_total,
        H_AMOUNT / NULLIF(SUM(H_AMOUNT) OVER (PARTITION BY H_W_ID), 0) AS share
    FROM dl.history_win
    WHERE H_AMOUNT > 0
);
----
0

query I
SELECT count(*) FROM (
    SELECT
        H_W_ID,
        H_D_ID,
        H_C_ID,
        H_AMOUNT,
        SUM(H_AMOUNT) OVER (PARTITION BY H_W_ID) AS w_total,
        H_AMOUNT / NULLIF(SUM(H_AMOUNT) OVER (PARTITION BY H_W_ID), 0) AS share
    FROM dl.history_win
    WHERE H_AMOUNT > 0
    EXCEPT ALL
    SELECT * FROM dl.mv_history_window
);
----
0

statement ok
CREATE TABLE dl.window_join_events (
    acct_id INT,
    event_ts INT,
    code INT,
    amount INT
);

statement ok
CREATE TABLE dl.window_join_codes (
    code INT,
    label VARCHAR
);

statement ok
CREATE MATERIALIZED VIEW dl.mv_window_join AS
SELECT
    e.acct_id,
    e.event_ts,
    c.label,
    SUM(e.amount) OVER (
        PARTITION BY e.acct_id
        ORDER BY e.event_ts
        ROWS BETWEEN UNBOUNDED PRECEDING AND CURRENT ROW
    ) AS running_amount
FROM dl.window_join_events e
LEFT JOIN dl.window_join_codes c
    ON e.code = c.code;

query I
SELECT group_columns FROM openivm_views WHERE view_name = 'mv_window_join';
----
acct_id=acct_id

statement ok
SET openivm_files_path='__TEST_DIR__';

statement ok
INSERT INTO dl.window_join_codes VALUES (1, 'open');

statement ok
INSERT INTO dl.window_join_events VALUES
    (10, 1, 1, 5),
    (10, 2, 2, 7),
    (20, 1, 1, 11);

statement ok
PRAGMA refresh('mv_window_join');

query I
SELECT contains(content, 'CREATE OR REPLACE TEMP TABLE openivm_old_affected_mv_window_join')
FROM read_text('__TEST_DIR__/openivm_upsert_queries_mv_window_join.sql');
----
true

query I
SELECT contains(content, 'DROP TABLE IF EXISTS openivm_old_affected_mv_window_join')
FROM read_text('__TEST_DIR__/openivm_upsert_queries_mv_window_join.sql');
----
true

query I
SELECT count(*) FROM (
    SELECT * FROM dl.mv_window_join
    EXCEPT ALL
    SELECT
        e.acct_id,
        e.event_ts,
        c.label,
        SUM(e.amount) OVER (
            PARTITION BY e.acct_id
            ORDER BY e.event_ts
            ROWS BETWEEN UNBOUNDED PRECEDING AND CURRENT ROW
        )
    FROM dl.window_join_events e
    LEFT JOIN dl.window_join_codes c
        ON e.code = c.code
);
----
0

statement ok
CREATE TABLE dl.trade_like (
    t_id INT,
    t_dts TIMESTAMP,
    t_status INT,
    t_type INT,
    t_qty INT
);

statement ok
CREATE TABLE dl.trade_history_like (
    th_t_id INT,
    th_dts TIMESTAMP,
    th_status INT
);

statement ok
CREATE TABLE dl.trade_status_like (
    status_id INT,
    status_name VARCHAR
);

statement ok
CREATE TABLE dl.trade_type_like (
    type_id INT,
    type_name VARCHAR
);

statement ok
CREATE MATERIALIZED VIEW dl.mv_trades_history_like AS
SELECT
    t_id AS trade_id,
    t_dts AS trade_timestamp,
    ts.status_name AS trade_status,
    tt.type_name AS trade_type,
    us.status_name AS update_status,
    th_dts AS effective_timestamp,
    COALESCE(
        LAG(th_dts) OVER (
            PARTITION BY t_id
            ORDER BY th_dts DESC, t_dts DESC, th_status DESC
        ) - INTERVAL 1 MILLISECOND,
        TIMESTAMP '9999-12-31 23:59:59.999'
    ) AS end_timestamp,
    CASE
        WHEN ROW_NUMBER() OVER (
            PARTITION BY t_id
            ORDER BY th_dts DESC, t_dts DESC, th_status DESC
        ) = 1 THEN TRUE
        ELSE FALSE
    END AS is_current
FROM dl.trade_like
JOIN dl.trade_history_like
    ON t_id = th_t_id
JOIN dl.trade_type_like tt
    ON t_type = tt.type_id
JOIN dl.trade_status_like ts
    ON t_status = ts.status_id
JOIN dl.trade_status_like us
    ON th_status = us.status_id;

statement ok
INSERT INTO dl.trade_status_like VALUES (1, 'new'), (2, 'settled'), (3, 'closed');

statement ok
INSERT INTO dl.trade_type_like VALUES (10, 'cash');

statement ok
INSERT INTO dl.trade_like VALUES
    (100, '2026-01-01 09:00:00', 1, 10, 50),
    (200, '2026-01-01 10:00:00', 1, 10, 60);

statement ok
INSERT INTO dl.trade_history_like VALUES
    (100, '2026-01-01 09:05:00', 1),
    (200, '2026-01-01 10:05:00', 1);

statement ok
PRAGMA refresh('mv_trades_history_like');

statement ok
INSERT INTO dl.trade_like VALUES
    (100, '2026-01-02 09:00:00', 2, 10, 50),
    (300, '2026-01-02 11:00:00', 1, 10, 70);

statement ok
INSERT INTO dl.trade_history_like VALUES
    (100, '2026-01-02 09:05:00', 2),
    (300, '2026-01-02 11:05:00', 1);

statement ok
PRAGMA refresh('mv_trades_history_like');

query I
SELECT contains(content, 'CREATE OR REPLACE TEMP TABLE openivm_old_affected_mv_trades_history_like')
FROM read_text('__TEST_DIR__/openivm_upsert_queries_mv_trades_history_like.sql');
----
true

query I
SELECT contains(content, 'SELECT * FROM dl.main.openivm_data_mv_trades_history_like openivm_old_rows')
FROM read_text('__TEST_DIR__/openivm_upsert_queries_mv_trades_history_like.sql');
----
false

query I
SELECT contains(content, 'ducklake_table_insertions')
FROM read_text('__TEST_DIR__/openivm_upsert_queries_mv_trades_history_like.sql');
----
true

statement ok
UPDATE dl.trade_status_like SET status_name = 'settled-updated' WHERE status_id = 2;

statement ok
PRAGMA refresh('mv_trades_history_like');

query I
SELECT count(*) FROM (
    SELECT * FROM dl.mv_trades_history_like
    EXCEPT ALL
    SELECT
        t_id AS trade_id,
        t_dts AS trade_timestamp,
        ts.status_name AS trade_status,
        tt.type_name AS trade_type,
        us.status_name AS update_status,
        th_dts AS effective_timestamp,
        COALESCE(
            LAG(th_dts) OVER (
                PARTITION BY t_id
                ORDER BY th_dts DESC, t_dts DESC, th_status DESC
            ) - INTERVAL 1 MILLISECOND,
            TIMESTAMP '9999-12-31 23:59:59.999'
        ) AS end_timestamp,
        CASE
            WHEN ROW_NUMBER() OVER (
                PARTITION BY t_id
                ORDER BY th_dts DESC, t_dts DESC, th_status DESC
            ) = 1 THEN TRUE
            ELSE FALSE
        END AS is_current
    FROM dl.trade_like
    JOIN dl.trade_history_like
        ON t_id = th_t_id
    JOIN dl.trade_type_like tt
        ON t_type = tt.type_id
    JOIN dl.trade_status_like ts
        ON t_status = ts.status_id
    JOIN dl.trade_status_like us
        ON th_status = us.status_id
);
----
0

query I
SELECT count(*) FROM (
    SELECT
        t_id AS trade_id,
        t_dts AS trade_timestamp,
        ts.status_name AS trade_status,
        tt.type_name AS trade_type,
        us.status_name AS update_status,
        th_dts AS effective_timestamp,
        COALESCE(
            LAG(th_dts) OVER (
                PARTITION BY t_id
                ORDER BY th_dts DESC, t_dts DESC, th_status DESC
            ) - INTERVAL 1 MILLISECOND,
            TIMESTAMP '9999-12-31 23:59:59.999'
        ) AS end_timestamp,
        CASE
            WHEN ROW_NUMBER() OVER (
                PARTITION BY t_id
                ORDER BY th_dts DESC, t_dts DESC, th_status DESC
            ) = 1 THEN TRUE
            ELSE FALSE
        END AS is_current
    FROM dl.trade_like
    JOIN dl.trade_history_like
        ON t_id = th_t_id
    JOIN dl.trade_type_like tt
        ON t_type = tt.type_id
    JOIN dl.trade_status_like ts
        ON t_status = ts.status_id
    JOIN dl.trade_status_like us
        ON th_status = us.status_id
    EXCEPT ALL
    SELECT * FROM dl.mv_trades_history_like
);
----
0

# Regression: chained DuckLake MV creation must not reconnect immediately after
# DuckLake CTAS. Complex plans that read a DuckLake-backed MV and publish another
# DuckLake MV can otherwise self-lock DuckLake's SQLite metadata catalog.
statement ok
CREATE TABLE dl.market_chain_src (
    sym VARCHAR,
    d DATE,
    close_px DOUBLE,
    volume INT
);

statement ok
INSERT INTO dl.market_chain_src VALUES
    ('AAA', '2026-01-01', 10.0, 100),
    ('AAA', '2026-01-02', 12.0, 200),
    ('AAA', '2026-01-03', 11.0, 150),
    ('BBB', '2026-01-01', 20.0, 90),
    ('BBB', '2026-01-02', 21.0, 110),
    ('BBB', '2026-01-03', 22.0, 130);

statement ok
CREATE MATERIALIZED VIEW dl.market_chain_base AS
SELECT sym, d, close_px, volume
FROM dl.market_chain_src;

statement ok
CREATE MATERIALIZED VIEW dl.market_chain_scored AS
WITH price_changes AS (
    SELECT
        sym,
        d,
        close_px,
        volume,
        LAG(close_px) OVER (PARTITION BY sym ORDER BY d) AS prev_close
    FROM dl.market_chain_base
),
returns AS (
    SELECT
        sym,
        d,
        close_px,
        volume,
        CASE WHEN prev_close > 0 THEN (close_px - prev_close) / prev_close ELSE NULL END AS daily_return
    FROM price_changes
),
symbol_stats AS (
    SELECT
        sym,
        COUNT(*) AS trading_days,
        AVG(daily_return) AS avg_return,
        STDDEV(daily_return) AS return_volatility,
        SUM(volume) AS total_volume
    FROM returns
    GROUP BY sym
),
global_stats AS (
    SELECT
        AVG(return_volatility) AS avg_volatility,
        SUM(total_volume) AS market_volume
    FROM symbol_stats
)
SELECT
    ss.sym,
    ss.trading_days,
    ss.avg_return,
    ss.return_volatility,
    ss.total_volume,
    ROUND(ss.return_volatility - gs.avg_volatility, 4) AS volatility_delta,
    RANK() OVER (ORDER BY ss.total_volume DESC) AS volume_rank
FROM symbol_stats ss
CROSS JOIN global_stats gs;

query I
SELECT count(*) FROM (
    SELECT
        sym,
        trading_days,
        ROUND(avg_return, 10) AS avg_return,
        ROUND(return_volatility, 10) AS return_volatility,
        total_volume,
        volatility_delta,
        volume_rank
    FROM dl.market_chain_scored
    EXCEPT ALL
    SELECT * FROM (
    WITH price_changes AS (
        SELECT
            sym,
            d,
            close_px,
            volume,
            LAG(close_px) OVER (PARTITION BY sym ORDER BY d) AS prev_close
        FROM dl.market_chain_base
    ),
    returns AS (
        SELECT
            sym,
            d,
            close_px,
            volume,
            CASE WHEN prev_close > 0 THEN (close_px - prev_close) / prev_close ELSE NULL END AS daily_return
        FROM price_changes
    ),
    symbol_stats AS (
        SELECT
            sym,
            COUNT(*) AS trading_days,
            AVG(daily_return) AS avg_return,
            STDDEV(daily_return) AS return_volatility,
            SUM(volume) AS total_volume
        FROM returns
        GROUP BY sym
    ),
    global_stats AS (
        SELECT
            AVG(return_volatility) AS avg_volatility,
            SUM(total_volume) AS market_volume
        FROM symbol_stats
    )
    SELECT
        ss.sym,
        ss.trading_days,
        ROUND(ss.avg_return, 10) AS avg_return,
        ROUND(ss.return_volatility, 10) AS return_volatility,
        ss.total_volume,
        ROUND(ss.return_volatility - gs.avg_volatility, 4) AS volatility_delta,
        RANK() OVER (ORDER BY ss.total_volume DESC) AS volume_rank
    FROM symbol_stats ss
    CROSS JOIN global_stats gs
    ) expected
);
----
0

query I
SELECT count(*) FROM (
    SELECT * FROM (
    WITH price_changes AS (
        SELECT
            sym,
            d,
            close_px,
            volume,
            LAG(close_px) OVER (PARTITION BY sym ORDER BY d) AS prev_close
        FROM dl.market_chain_base
    ),
    returns AS (
        SELECT
            sym,
            d,
            close_px,
            volume,
            CASE WHEN prev_close > 0 THEN (close_px - prev_close) / prev_close ELSE NULL END AS daily_return
        FROM price_changes
    ),
    symbol_stats AS (
        SELECT
            sym,
            COUNT(*) AS trading_days,
            AVG(daily_return) AS avg_return,
            STDDEV(daily_return) AS return_volatility,
            SUM(volume) AS total_volume
        FROM returns
        GROUP BY sym
    ),
    global_stats AS (
        SELECT
            AVG(return_volatility) AS avg_volatility,
            SUM(total_volume) AS market_volume
        FROM symbol_stats
    )
    SELECT
        ss.sym,
        ss.trading_days,
        ROUND(ss.avg_return, 10) AS avg_return,
        ROUND(ss.return_volatility, 10) AS return_volatility,
        ss.total_volume,
        ROUND(ss.return_volatility - gs.avg_volatility, 4) AS volatility_delta,
        RANK() OVER (ORDER BY ss.total_volume DESC) AS volume_rank
    FROM symbol_stats ss
    CROSS JOIN global_stats gs
    ) expected
    EXCEPT ALL
    SELECT
        sym,
        trading_days,
        ROUND(avg_return, 10) AS avg_return,
        ROUND(return_volatility, 10) AS return_volatility,
        total_volume,
        volatility_delta,
        volume_rank
    FROM dl.market_chain_scored
);
----
0

statement ok
SET openivm_cascade_refresh = 'off';

statement ok
CREATE TABLE dl.accounts_crm_src (
    ca_id INT,
    action_ts TIMESTAMP,
    action_type VARCHAR,
    nat_tax_id INT,
    lcl_tax_id INT,
    balance INT
);

statement ok
CREATE TABLE dl.accounts_tax_src (
    tax_id INT,
    tax_rate DECIMAL(6, 4)
);

statement ok
CREATE MATERIALIZED VIEW dl.accounts_crm AS
SELECT
    ca_id,
    action_ts,
    action_type,
    nat_tax_id,
    lcl_tax_id,
    balance
FROM dl.accounts_crm_src;

statement ok
CREATE MATERIALIZED VIEW dl.accounts_tax AS
SELECT
    tax_id,
    tax_rate
FROM dl.accounts_tax_src;

statement ok
CREATE MATERIALIZED VIEW dl.mv_accounts_like AS
SELECT
    c.ca_id AS account_id,
    c.action_ts AS start_timestamp,
    COALESCE(
        LAG(c.action_ts) OVER (PARTITION BY c.ca_id ORDER BY c.action_ts DESC) - INTERVAL 1 MILLISECOND,
        TIMESTAMP '9999-12-31 23:59:59.999'
    ) AS end_timestamp,
    CASE
        WHEN ROW_NUMBER() OVER (PARTITION BY c.ca_id ORDER BY c.action_ts DESC) = 1 THEN TRUE
        ELSE FALSE
    END AS is_current,
    c.action_type,
    c.balance,
    ntx.tax_rate AS nat_tax_rate,
    ltx.tax_rate AS lcl_tax_rate
FROM "dl"."main"."accounts_crm" c
LEFT JOIN "dl"."main"."accounts_tax" ntx
    ON c.nat_tax_id = ntx.tax_id
LEFT JOIN "dl"."main"."accounts_tax" ltx
    ON c.lcl_tax_id = ltx.tax_id
WHERE c.ca_id IS NOT NULL;

query I
SELECT group_columns FROM openivm_views WHERE view_name = 'mv_accounts_like';
----
account_id=ca_id

statement ok
INSERT INTO dl.accounts_tax_src VALUES
    (1, 0.0500),
    (2, 0.0750);

statement ok
INSERT INTO dl.accounts_crm_src VALUES
    (10, '2026-01-01 09:00:00', 'NEW', 1, 2, 100),
    (20, '2026-01-01 10:00:00', 'NEW', 2, 1, 200);

statement ok
PRAGMA refresh('accounts_tax');

statement ok
PRAGMA refresh('accounts_crm');

statement ok
PRAGMA refresh('mv_accounts_like');

statement ok
INSERT INTO dl.accounts_crm_src VALUES
    (30, '2026-01-02 09:00:00', 'NEW', 1, 2, 300),
    (10, '2026-01-02 10:00:00', 'UPDATE', 2, 1, 150);

statement ok
PRAGMA refresh('accounts_crm');

statement ok
PRAGMA refresh('mv_accounts_like');

query I
SELECT count(*) FROM (
    SELECT * FROM dl.mv_accounts_like
    EXCEPT ALL
    SELECT
        c.ca_id AS account_id,
        c.action_ts AS start_timestamp,
        COALESCE(
            LAG(c.action_ts) OVER (PARTITION BY c.ca_id ORDER BY c.action_ts DESC) - INTERVAL 1 MILLISECOND,
            TIMESTAMP '9999-12-31 23:59:59.999'
        ) AS end_timestamp,
        CASE
            WHEN ROW_NUMBER() OVER (PARTITION BY c.ca_id ORDER BY c.action_ts DESC) = 1 THEN TRUE
            ELSE FALSE
        END AS is_current,
        c.action_type,
        c.balance,
        ntx.tax_rate AS nat_tax_rate,
        ltx.tax_rate AS lcl_tax_rate
    FROM dl.accounts_crm c
    LEFT JOIN dl.accounts_tax ntx
        ON c.nat_tax_id = ntx.tax_id
    LEFT JOIN dl.accounts_tax ltx
        ON c.lcl_tax_id = ltx.tax_id
    WHERE c.ca_id IS NOT NULL
);
----
0

query I
SELECT count(*) FROM (
    SELECT
        c.ca_id AS account_id,
        c.action_ts AS start_timestamp,
        COALESCE(
            LAG(c.action_ts) OVER (PARTITION BY c.ca_id ORDER BY c.action_ts DESC) - INTERVAL 1 MILLISECOND,
            TIMESTAMP '9999-12-31 23:59:59.999'
        ) AS end_timestamp,
        CASE
            WHEN ROW_NUMBER() OVER (PARTITION BY c.ca_id ORDER BY c.action_ts DESC) = 1 THEN TRUE
            ELSE FALSE
        END AS is_current,
        c.action_type,
        c.balance,
        ntx.tax_rate AS nat_tax_rate,
        ltx.tax_rate AS lcl_tax_rate
    FROM dl.accounts_crm c
    LEFT JOIN dl.accounts_tax ntx
        ON c.nat_tax_id = ntx.tax_id
    LEFT JOIN dl.accounts_tax ltx
        ON c.lcl_tax_id = ltx.tax_id
    WHERE c.ca_id IS NOT NULL
    EXCEPT ALL
    SELECT * FROM dl.mv_accounts_like
);
----
0

# A failed/retried DuckLake CREATE MV can leave metadata behind before the
# physical DuckLake view/data tables are created. Retrying should clean that
# stale metadata row, not fail with a duplicate materialized-view error.
statement ok
CREATE TABLE dl.retry_window_src (
    acct_id INT,
    event_ts INT,
    amount INT
);

statement ok
INSERT INTO openivm_views (view_name, sql_string, type, last_update)
VALUES ('mv_retry_window', 'stale interrupted create', 5, now());

query I
SELECT count(*) FROM openivm_views WHERE view_name = 'mv_retry_window';
----
1

statement ok
CREATE MATERIALIZED VIEW dl.mv_retry_window AS
SELECT
    acct_id,
    event_ts,
    SUM(amount) OVER (PARTITION BY acct_id ORDER BY event_ts) AS running_amount
FROM dl.retry_window_src;

query I
SELECT count(*) FROM openivm_views WHERE view_name = 'mv_retry_window';
----
1

statement error
CREATE MATERIALIZED VIEW dl.mv_retry_window AS
SELECT acct_id, event_ts, amount FROM dl.retry_window_src;
----
already exists

statement ok
CREATE TABLE dl.stage_lock_market_src (
    sym VARCHAR,
    trade_date DATE,
    close_price DOUBLE,
    high_price DOUBLE,
    low_price DOUBLE,
    volume INT
);

statement ok
INSERT INTO dl.stage_lock_market_src
SELECT
    'S' || CAST(i % 20 AS VARCHAR) AS sym,
    DATE '2026-01-01' + CAST(i % 120 AS INTEGER) AS trade_date,
    100.0 + CAST(i % 31 AS DOUBLE) AS close_price,
    105.0 + CAST(i % 31 AS DOUBLE) AS high_price,
    95.0 + CAST(i % 31 AS DOUBLE) AS low_price,
    CAST(1000 + i AS INTEGER) AS volume
FROM range(0, 2000) AS r(i);

statement ok
CREATE MATERIALIZED VIEW dl.mv_ducklake_stage_lock AS
WITH price_changes AS (
    SELECT
        sym,
        trade_date,
        close_price,
        high_price - low_price AS intraday_range,
        volume,
        LAG(close_price) OVER (PARTITION BY sym ORDER BY trade_date) AS prev_close
    FROM dl.stage_lock_market_src
),
daily_returns AS (
    SELECT
        sym,
        trade_date,
        close_price,
        intraday_range,
        volume,
        CASE WHEN prev_close > 0 THEN (close_price - prev_close) / prev_close ELSE NULL END AS daily_return
    FROM price_changes
),
symbol_volatility AS (
    SELECT
        sym,
        COUNT(*) AS trading_days,
        AVG(daily_return) AS avg_daily_return,
        STDDEV(daily_return) AS return_volatility,
        AVG(intraday_range) AS avg_intraday_range,
        SUM(CAST(volume AS BIGINT)) AS total_volume
    FROM daily_returns
    GROUP BY sym
    HAVING COUNT(daily_return) >= 3
),
global_market AS (
    SELECT
        AVG(return_volatility) AS market_avg_volatility,
        SUM(total_volume) AS market_total_volume
    FROM symbol_volatility
),
scored AS (
    SELECT
        sv.*,
        ROUND(sv.total_volume * 100.0 / NULLIF(gm.market_total_volume, 0), 4) AS pct_market_volume,
        RANK() OVER (ORDER BY sv.return_volatility DESC) AS rank_by_volatility
    FROM symbol_volatility sv
    CROSS JOIN global_market gm
)
SELECT * FROM scored;

query I
SELECT count(*) FROM dl.mv_ducklake_stage_lock;
----
20

query I
SELECT count(*) FROM information_schema.tables WHERE table_name = 'openivm_stage_mv_ducklake_stage_lock';
----
0

statement ok
SET openivm_cascade_refresh = 'downstream';

statement ok
CREATE TABLE dl.cascade_accounts_crm_src (
    ca_id INT,
    action_ts TIMESTAMP,
    nat_tax_id INT,
    lcl_tax_id INT
);

statement ok
CREATE TABLE dl.cascade_accounts_tax_src (
    tax_id INT,
    tax_rate DECIMAL(6, 4)
);

statement ok
CREATE MATERIALIZED VIEW dl.cascade_accounts_crm AS
SELECT
    ca_id,
    action_ts,
    nat_tax_id,
    lcl_tax_id
FROM dl.cascade_accounts_crm_src;

statement ok
CREATE MATERIALIZED VIEW dl.cascade_accounts_tax AS
SELECT
    tax_id,
    tax_rate
FROM dl.cascade_accounts_tax_src;

statement ok
CREATE MATERIALIZED VIEW dl.mv_cascade_accounts_like AS
SELECT
    c.ca_id AS account_id,
    c.action_ts AS start_timestamp,
    COALESCE(
        LAG(c.action_ts) OVER (PARTITION BY c.ca_id ORDER BY c.action_ts DESC) - INTERVAL 1 MILLISECOND,
        TIMESTAMP '9999-12-31 23:59:59.999'
    ) AS end_timestamp,
    ntx.tax_rate AS nat_tax_rate,
    ltx.tax_rate AS lcl_tax_rate
FROM "dl"."main"."cascade_accounts_crm" c
LEFT JOIN "dl"."main"."cascade_accounts_tax" ntx
    ON c.nat_tax_id = ntx.tax_id
LEFT JOIN "dl"."main"."cascade_accounts_tax" ltx
    ON c.lcl_tax_id = ltx.tax_id
WHERE c.ca_id IS NOT NULL;

statement ok
INSERT INTO dl.cascade_accounts_tax_src VALUES
    (1, 0.0500),
    (2, 0.0750);

statement ok
INSERT INTO dl.cascade_accounts_crm_src VALUES
    (10, '2026-01-01 09:00:00', 1, 2),
    (20, '2026-01-01 10:00:00', 2, 1);

# Refresh one upstream parent first. This cascades into the downstream window
# MV before the other upstream parent has been refreshed; the later parent
# refresh must still recover the downstream MV.
statement ok
PRAGMA refresh('cascade_accounts_tax');

query I
SELECT count(*) FROM dl.mv_cascade_accounts_like;
----
0

statement ok
PRAGMA refresh('cascade_accounts_crm');

query I
SELECT count(*) FROM (
    SELECT * FROM dl.mv_cascade_accounts_like
    EXCEPT ALL
    SELECT
        c.ca_id AS account_id,
        c.action_ts AS start_timestamp,
        COALESCE(
            LAG(c.action_ts) OVER (PARTITION BY c.ca_id ORDER BY c.action_ts DESC) - INTERVAL 1 MILLISECOND,
            TIMESTAMP '9999-12-31 23:59:59.999'
        ) AS end_timestamp,
        ntx.tax_rate AS nat_tax_rate,
        ltx.tax_rate AS lcl_tax_rate
    FROM dl.cascade_accounts_crm c
    LEFT JOIN dl.cascade_accounts_tax ntx
        ON c.nat_tax_id = ntx.tax_id
    LEFT JOIN dl.cascade_accounts_tax ltx
        ON c.lcl_tax_id = ltx.tax_id
    WHERE c.ca_id IS NOT NULL
);
----
0

query I
SELECT count(*) FROM (
    SELECT
        c.ca_id AS account_id,
        c.action_ts AS start_timestamp,
        COALESCE(
            LAG(c.action_ts) OVER (PARTITION BY c.ca_id ORDER BY c.action_ts DESC) - INTERVAL 1 MILLISECOND,
            TIMESTAMP '9999-12-31 23:59:59.999'
        ) AS end_timestamp,
        ntx.tax_rate AS nat_tax_rate,
        ltx.tax_rate AS lcl_tax_rate
    FROM dl.cascade_accounts_crm c
    LEFT JOIN dl.cascade_accounts_tax ntx
        ON c.nat_tax_id = ntx.tax_id
    LEFT JOIN dl.cascade_accounts_tax ltx
        ON c.lcl_tax_id = ltx.tax_id
    WHERE c.ca_id IS NOT NULL
    EXCEPT ALL
    SELECT * FROM dl.mv_cascade_accounts_like
);
----
0

statement ok
SET openivm_cascade_refresh = 'downstream';

statement ok
CREATE TABLE dl.window_upstream_src (
    acct_id INT,
    event_ts INT,
    amount INT
);

statement ok
CREATE MATERIALIZED VIEW dl.window_upstream_base AS
SELECT
    acct_id,
    event_ts,
    amount
FROM dl.window_upstream_src;

statement ok
CREATE MATERIALIZED VIEW dl.mv_window_upstream AS
SELECT
    acct_id,
    event_ts,
    SUM(amount) OVER (
        PARTITION BY acct_id
        ORDER BY event_ts DESC
        ROWS BETWEEN UNBOUNDED PRECEDING AND CURRENT ROW
    ) AS running_amount
FROM dl.window_upstream_base;

query I
SELECT group_columns FROM openivm_views WHERE view_name = 'mv_window_upstream';
----
acct_id=acct_id

statement ok
INSERT INTO dl.window_upstream_src VALUES
    (1, 10, 100),
    (2, 10, 200);

statement ok
PRAGMA refresh('window_upstream_base');

statement ok
PRAGMA refresh('mv_window_upstream');

query I
SELECT count(*) FROM (
    SELECT * FROM dl.mv_window_upstream
    EXCEPT ALL
    SELECT
        acct_id,
        event_ts,
        SUM(amount) OVER (
            PARTITION BY acct_id
            ORDER BY event_ts DESC
            ROWS BETWEEN UNBOUNDED PRECEDING AND CURRENT ROW
        )
    FROM dl.window_upstream_base
);
----
0

statement ok
INSERT INTO dl.window_upstream_src VALUES
    (3, 10, 300),
    (1, 20, 50);

statement ok
PRAGMA refresh('window_upstream_base');

statement ok
PRAGMA refresh('mv_window_upstream');

query I
SELECT count(*) FROM (
    SELECT * FROM dl.mv_window_upstream
    EXCEPT ALL
    SELECT
        acct_id,
        event_ts,
        SUM(amount) OVER (
            PARTITION BY acct_id
            ORDER BY event_ts DESC
            ROWS BETWEEN UNBOUNDED PRECEDING AND CURRENT ROW
        )
    FROM dl.window_upstream_base
);
----
0

query I
SELECT count(*) FROM (
    SELECT
        acct_id,
        event_ts,
        SUM(amount) OVER (
            PARTITION BY acct_id
            ORDER BY event_ts DESC
            ROWS BETWEEN UNBOUNDED PRECEDING AND CURRENT ROW
        )
    FROM dl.window_upstream_base
    EXCEPT ALL
    SELECT * FROM dl.mv_window_upstream
);
----
0

statement ok
INSERT INTO dl.window_join_codes VALUES (2, 'closed');

statement ok
PRAGMA refresh('mv_window_join');

query I
SELECT count(*) FROM (
    SELECT * FROM dl.mv_window_join
    EXCEPT ALL
    SELECT
        e.acct_id,
        e.event_ts,
        c.label,
        SUM(e.amount) OVER (
            PARTITION BY e.acct_id
            ORDER BY e.event_ts
            ROWS BETWEEN UNBOUNDED PRECEDING AND CURRENT ROW
        )
    FROM dl.window_join_events e
    LEFT JOIN dl.window_join_codes c
        ON e.code = c.code
);
----
0
