# name: test/sql/full_outer_join.test
# description: Test IVM with FULL OUTER JOIN (Zhang & Larson bidirectional recompute)
# group: [sql]

require openivm

statement ok
SET openivm_cascade_refresh = 'off';

# ============================================================
# Setup
# ============================================================

statement ok
CREATE TABLE employees (id INT, name VARCHAR);

statement ok
CREATE TABLE projects (id INT, emp_id INT, title VARCHAR);

statement ok
INSERT INTO employees VALUES (1, 'Alice'), (2, 'Bob'), (3, 'Charlie');

statement ok
INSERT INTO projects VALUES (10, 1, 'Alpha'), (20, 1, 'Beta'), (30, 4, 'Gamma');

# ============================================================
# Basic FULL OUTER JOIN projection
# ============================================================

statement ok
CREATE MATERIALIZED VIEW emp_projects AS
    SELECT e.name, p.title
    FROM employees e FULL OUTER JOIN projects p ON e.id = p.emp_id;

# Initial: Alice matched (2 projects), Bob/Charlie unmatched-left, Gamma unmatched-right
query II
SELECT * FROM emp_projects ORDER BY name NULLS LAST, title NULLS LAST;
----
Alice	Alpha
Alice	Beta
Bob	NULL
Charlie	NULL
NULL	Gamma

# EXCEPT ALL both directions
query I
SELECT COUNT(*) FROM (
    SELECT e.name, p.title FROM employees e FULL OUTER JOIN projects p ON e.id = p.emp_id
    EXCEPT ALL
    SELECT * FROM emp_projects
);
----
0

query I
SELECT COUNT(*) FROM (
    SELECT * FROM emp_projects
    EXCEPT ALL
    SELECT e.name, p.title FROM employees e FULL OUTER JOIN projects p ON e.id = p.emp_id
);
----
0

# ============================================================
# Insert into right side: Bob gets a project (unmatched-left -> matched)
# ============================================================

statement ok
INSERT INTO projects VALUES (40, 2, 'Delta');

statement ok
PRAGMA refresh('emp_projects');

query I
SELECT COUNT(*) FROM (
    SELECT e.name, p.title FROM employees e FULL OUTER JOIN projects p ON e.id = p.emp_id
    EXCEPT ALL
    SELECT * FROM emp_projects
);
----
0

query I
SELECT COUNT(*) FROM (
    SELECT * FROM emp_projects
    EXCEPT ALL
    SELECT e.name, p.title FROM employees e FULL OUTER JOIN projects p ON e.id = p.emp_id
);
----
0

# ============================================================
# Insert into right side with no match: new unmatched-right row
# ============================================================

statement ok
INSERT INTO projects VALUES (50, 99, 'Epsilon');

statement ok
PRAGMA refresh('emp_projects');

query I
SELECT COUNT(*) FROM (
    SELECT e.name, p.title FROM employees e FULL OUTER JOIN projects p ON e.id = p.emp_id
    EXCEPT ALL
    SELECT * FROM emp_projects
);
----
0

query I
SELECT COUNT(*) FROM (
    SELECT * FROM emp_projects
    EXCEPT ALL
    SELECT e.name, p.title FROM employees e FULL OUTER JOIN projects p ON e.id = p.emp_id
);
----
0

# ============================================================
# Delete from right side: remove Alice's last project on Alpha
# (matched pair removed; Alice still has Beta)
# ============================================================

statement ok
DELETE FROM projects WHERE id = 10;

statement ok
PRAGMA refresh('emp_projects');

query I
SELECT COUNT(*) FROM (
    SELECT e.name, p.title FROM employees e FULL OUTER JOIN projects p ON e.id = p.emp_id
    EXCEPT ALL
    SELECT * FROM emp_projects
);
----
0

query I
SELECT COUNT(*) FROM (
    SELECT * FROM emp_projects
    EXCEPT ALL
    SELECT e.name, p.title FROM employees e FULL OUTER JOIN projects p ON e.id = p.emp_id
);
----
0

# ============================================================
# Delete from right side: remove Alice's last project (Beta)
# She should become unmatched-left (Alice, NULL)
# ============================================================

statement ok
DELETE FROM projects WHERE id = 20;

statement ok
PRAGMA refresh('emp_projects');

query I
SELECT COUNT(*) FROM (
    SELECT e.name, p.title FROM employees e FULL OUTER JOIN projects p ON e.id = p.emp_id
    EXCEPT ALL
    SELECT * FROM emp_projects
);
----
0

query I
SELECT COUNT(*) FROM (
    SELECT * FROM emp_projects
    EXCEPT ALL
    SELECT e.name, p.title FROM employees e FULL OUTER JOIN projects p ON e.id = p.emp_id
);
----
0

# ============================================================
# Insert into left side: new employee with no project (unmatched-left)
# ============================================================

statement ok
INSERT INTO employees VALUES (5, 'Eve');

statement ok
PRAGMA refresh('emp_projects');

query I
SELECT COUNT(*) FROM (
    SELECT e.name, p.title FROM employees e FULL OUTER JOIN projects p ON e.id = p.emp_id
    EXCEPT ALL
    SELECT * FROM emp_projects
);
----
0

query I
SELECT COUNT(*) FROM (
    SELECT * FROM emp_projects
    EXCEPT ALL
    SELECT e.name, p.title FROM employees e FULL OUTER JOIN projects p ON e.id = p.emp_id
);
----
0

# ============================================================
# Delete unmatched-right: remove Gamma (emp_id=4, no matching employee)
# ============================================================

statement ok
DELETE FROM projects WHERE id = 30;

statement ok
PRAGMA refresh('emp_projects');

query I
SELECT COUNT(*) FROM (
    SELECT e.name, p.title FROM employees e FULL OUTER JOIN projects p ON e.id = p.emp_id
    EXCEPT ALL
    SELECT * FROM emp_projects
);
----
0

query I
SELECT COUNT(*) FROM (
    SELECT * FROM emp_projects
    EXCEPT ALL
    SELECT e.name, p.title FROM employees e FULL OUTER JOIN projects p ON e.id = p.emp_id
);
----
0

# ============================================================
# Stress: batch mixed DML on both sides before single refresh
# ============================================================

statement ok
INSERT INTO employees VALUES (6, 'Frank');

statement ok
INSERT INTO projects VALUES (60, 6, 'Zeta'), (70, 5, 'Eta'), (80, 100, 'Theta');

statement ok
DELETE FROM employees WHERE id = 2;

statement ok
DELETE FROM projects WHERE id = 50;

statement ok
PRAGMA refresh('emp_projects');

query I
SELECT COUNT(*) FROM (
    SELECT e.name, p.title FROM employees e FULL OUTER JOIN projects p ON e.id = p.emp_id
    EXCEPT ALL
    SELECT * FROM emp_projects
);
----
0

query I
SELECT COUNT(*) FROM (
    SELECT * FROM emp_projects
    EXCEPT ALL
    SELECT e.name, p.title FROM employees e FULL OUTER JOIN projects p ON e.id = p.emp_id
);
----
0

# ============================================================
# FULL OUTER JOIN aggregate with GROUP BY (group-recompute mode)
# ============================================================

statement ok
CREATE TABLE departments (id INT, dept VARCHAR);

statement ok
CREATE TABLE staff (id INT, dept_id INT, salary INT);

statement ok
INSERT INTO departments VALUES (1, 'Eng'), (2, 'Sales'), (3, 'HR');

statement ok
INSERT INTO staff VALUES (1, 1, 100), (2, 1, 200), (3, 4, 300);

statement ok
CREATE MATERIALIZED VIEW dept_stats AS
    SELECT d.dept, SUM(s.salary) AS total_sal, COUNT(s.salary) AS cnt
    FROM departments d FULL OUTER JOIN staff s ON d.id = s.dept_id
    GROUP BY d.dept;

# Initial check
query I
SELECT COUNT(*) FROM (
    SELECT d.dept, SUM(s.salary), COUNT(s.salary) FROM departments d FULL OUTER JOIN staff s ON d.id = s.dept_id GROUP BY d.dept
    EXCEPT ALL
    SELECT * FROM dept_stats
);
----
0

query I
SELECT COUNT(*) FROM (
    SELECT * FROM dept_stats
    EXCEPT ALL
    SELECT d.dept, SUM(s.salary), COUNT(s.salary) FROM departments d FULL OUTER JOIN staff s ON d.id = s.dept_id GROUP BY d.dept
);
----
0

# Insert staff into Sales (was unmatched-left, now matched)
statement ok
INSERT INTO staff VALUES (4, 2, 150);

statement ok
PRAGMA refresh('dept_stats');

query I
SELECT COUNT(*) FROM (
    SELECT d.dept, SUM(s.salary), COUNT(s.salary) FROM departments d FULL OUTER JOIN staff s ON d.id = s.dept_id GROUP BY d.dept
    EXCEPT ALL
    SELECT * FROM dept_stats
);
----
0

query I
SELECT COUNT(*) FROM (
    SELECT * FROM dept_stats
    EXCEPT ALL
    SELECT d.dept, SUM(s.salary), COUNT(s.salary) FROM departments d FULL OUTER JOIN staff s ON d.id = s.dept_id GROUP BY d.dept
);
----
0

# Delete all staff from Eng (matched -> unmatched-left)
statement ok
DELETE FROM staff WHERE dept_id = 1;

statement ok
PRAGMA refresh('dept_stats');

query I
SELECT COUNT(*) FROM (
    SELECT d.dept, SUM(s.salary), COUNT(s.salary) FROM departments d FULL OUTER JOIN staff s ON d.id = s.dept_id GROUP BY d.dept
    EXCEPT ALL
    SELECT * FROM dept_stats
);
----
0

query I
SELECT COUNT(*) FROM (
    SELECT * FROM dept_stats
    EXCEPT ALL
    SELECT d.dept, SUM(s.salary), COUNT(s.salary) FROM departments d FULL OUTER JOIN staff s ON d.id = s.dept_id GROUP BY d.dept
);
----
0

# Batch DML on both sides
statement ok
INSERT INTO departments VALUES (4, 'Legal');

statement ok
INSERT INTO staff VALUES (5, 3, 250), (6, 99, 400);

statement ok
DELETE FROM staff WHERE id = 3;

statement ok
PRAGMA refresh('dept_stats');

query I
SELECT COUNT(*) FROM (
    SELECT d.dept, SUM(s.salary), COUNT(s.salary) FROM departments d FULL OUTER JOIN staff s ON d.id = s.dept_id GROUP BY d.dept
    EXCEPT ALL
    SELECT * FROM dept_stats
);
----
0

query I
SELECT COUNT(*) FROM (
    SELECT * FROM dept_stats
    EXCEPT ALL
    SELECT d.dept, SUM(s.salary), COUNT(s.salary) FROM departments d FULL OUTER JOIN staff s ON d.id = s.dept_id GROUP BY d.dept
);
----
0

# ============================================================
# MERGE mode: Zhang & Larson incremental MERGE (openivm_full_outer_merge)
# ============================================================

statement ok
SET openivm_full_outer_merge = true;

statement ok
CREATE TABLE items (id INT, category VARCHAR);

statement ok
CREATE TABLE sales (id INT, item_id INT, amount INT);

statement ok
INSERT INTO items VALUES (1, 'A'), (2, 'B'), (3, 'C');

statement ok
INSERT INTO sales VALUES (1, 1, 100), (2, 1, 200), (3, 5, 300);

statement ok
CREATE MATERIALIZED VIEW cat_sales AS
    SELECT i.category, SUM(s.amount) AS total, COUNT(s.amount) AS cnt
    FROM items i FULL OUTER JOIN sales s ON i.id = s.item_id
    GROUP BY i.category;

# Initial check
query I
SELECT COUNT(*) FROM (
    SELECT i.category, SUM(s.amount), COUNT(s.amount) FROM items i FULL OUTER JOIN sales s ON i.id = s.item_id GROUP BY i.category
    EXCEPT ALL
    SELECT * FROM cat_sales
);
----
0

# --- MERGE: insert sale matching B (unmatched-left → matched) ---
statement ok
INSERT INTO sales VALUES (4, 2, 150);

statement ok
PRAGMA refresh('cat_sales');

query I
SELECT COUNT(*) FROM (
    SELECT i.category, SUM(s.amount), COUNT(s.amount) FROM items i FULL OUTER JOIN sales s ON i.id = s.item_id GROUP BY i.category
    EXCEPT ALL
    SELECT * FROM cat_sales
);
----
0

query I
SELECT COUNT(*) FROM (
    SELECT * FROM cat_sales
    EXCEPT ALL
    SELECT i.category, SUM(s.amount), COUNT(s.amount) FROM items i FULL OUTER JOIN sales s ON i.id = s.item_id GROUP BY i.category
);
----
0

# --- MERGE: insert unmatched-right sale (NULL group grows) ---
statement ok
INSERT INTO sales VALUES (5, 99, 400);

statement ok
PRAGMA refresh('cat_sales');

query I
SELECT COUNT(*) FROM (
    SELECT i.category, SUM(s.amount), COUNT(s.amount) FROM items i FULL OUTER JOIN sales s ON i.id = s.item_id GROUP BY i.category
    EXCEPT ALL
    SELECT * FROM cat_sales
);
----
0

query I
SELECT COUNT(*) FROM (
    SELECT * FROM cat_sales
    EXCEPT ALL
    SELECT i.category, SUM(s.amount), COUNT(s.amount) FROM items i FULL OUTER JOIN sales s ON i.id = s.item_id GROUP BY i.category
);
----
0

# --- MERGE: delete all sales for A (matched → unmatched-left, aggregates → NULL) ---
statement ok
DELETE FROM sales WHERE item_id = 1;

statement ok
PRAGMA refresh('cat_sales');

query I
SELECT COUNT(*) FROM (
    SELECT i.category, SUM(s.amount), COUNT(s.amount) FROM items i FULL OUTER JOIN sales s ON i.id = s.item_id GROUP BY i.category
    EXCEPT ALL
    SELECT * FROM cat_sales
);
----
0

query I
SELECT COUNT(*) FROM (
    SELECT * FROM cat_sales
    EXCEPT ALL
    SELECT i.category, SUM(s.amount), COUNT(s.amount) FROM items i FULL OUTER JOIN sales s ON i.id = s.item_id GROUP BY i.category
);
----
0

# --- MERGE: delete unmatched-right sale (NULL group shrinks) ---
statement ok
DELETE FROM sales WHERE id = 3;

statement ok
PRAGMA refresh('cat_sales');

query I
SELECT COUNT(*) FROM (
    SELECT i.category, SUM(s.amount), COUNT(s.amount) FROM items i FULL OUTER JOIN sales s ON i.id = s.item_id GROUP BY i.category
    EXCEPT ALL
    SELECT * FROM cat_sales
);
----
0

query I
SELECT COUNT(*) FROM (
    SELECT * FROM cat_sales
    EXCEPT ALL
    SELECT i.category, SUM(s.amount), COUNT(s.amount) FROM items i FULL OUTER JOIN sales s ON i.id = s.item_id GROUP BY i.category
);
----
0

# --- MERGE: cross-group transfer (add item matching unmatched-right sale) ---
statement ok
INSERT INTO items VALUES (99, 'X');

statement ok
PRAGMA refresh('cat_sales');

query I
SELECT COUNT(*) FROM (
    SELECT i.category, SUM(s.amount), COUNT(s.amount) FROM items i FULL OUTER JOIN sales s ON i.id = s.item_id GROUP BY i.category
    EXCEPT ALL
    SELECT * FROM cat_sales
);
----
0

query I
SELECT COUNT(*) FROM (
    SELECT * FROM cat_sales
    EXCEPT ALL
    SELECT i.category, SUM(s.amount), COUNT(s.amount) FROM items i FULL OUTER JOIN sales s ON i.id = s.item_id GROUP BY i.category
);
----
0

# --- MERGE: batch mixed DML ---
statement ok
INSERT INTO items VALUES (5, 'D');

statement ok
INSERT INTO sales VALUES (6, 3, 250), (7, 88, 500);

statement ok
DELETE FROM sales WHERE id = 4;

statement ok
DELETE FROM items WHERE id = 2;

statement ok
PRAGMA refresh('cat_sales');

query I
SELECT COUNT(*) FROM (
    SELECT i.category, SUM(s.amount), COUNT(s.amount) FROM items i FULL OUTER JOIN sales s ON i.id = s.item_id GROUP BY i.category
    EXCEPT ALL
    SELECT * FROM cat_sales
);
----
0

query I
SELECT COUNT(*) FROM (
    SELECT * FROM cat_sales
    EXCEPT ALL
    SELECT i.category, SUM(s.amount), COUNT(s.amount) FROM items i FULL OUTER JOIN sales s ON i.id = s.item_id GROUP BY i.category
);
----
0

# --- MERGE: left-side non-join group column changes under compound GROUP BY ---
statement ok
CREATE TABLE foj_attr_l (id INT, grp INT, attr INT);

statement ok
CREATE TABLE foj_attr_r (id INT, lid INT, amount INT);

statement ok
INSERT INTO foj_attr_l VALUES (1, 10, 50), (2, 10, 60), (3, 20, 70);

statement ok
INSERT INTO foj_attr_r VALUES (1, 1, 100), (2, 4, 400);

statement ok
CREATE MATERIALIZED VIEW foj_attr_mv AS
    SELECT COALESCE(l.grp, r.lid) AS g, COALESCE(l.id, r.lid) AS k, l.attr, SUM(r.amount) AS total
    FROM foj_attr_l l FULL OUTER JOIN foj_attr_r r ON l.id = r.lid
    GROUP BY COALESCE(l.grp, r.lid), COALESCE(l.id, r.lid), l.attr;

statement ok
UPDATE foj_attr_l SET attr = 55 WHERE id = 1;

statement ok
INSERT INTO foj_attr_r VALUES (3, 2, 200);

statement ok
PRAGMA refresh('foj_attr_mv');

query I
SELECT COUNT(*) FROM (
    SELECT COALESCE(l.grp, r.lid), COALESCE(l.id, r.lid), l.attr, SUM(r.amount)
    FROM foj_attr_l l FULL OUTER JOIN foj_attr_r r ON l.id = r.lid
    GROUP BY COALESCE(l.grp, r.lid), COALESCE(l.id, r.lid), l.attr
    EXCEPT ALL
    SELECT * FROM foj_attr_mv
);
----
0

query I
SELECT COUNT(*) FROM (
    SELECT * FROM foj_attr_mv
    EXCEPT ALL
    SELECT COALESCE(l.grp, r.lid), COALESCE(l.id, r.lid), l.attr, SUM(r.amount)
    FROM foj_attr_l l FULL OUTER JOIN foj_attr_r r ON l.id = r.lid
    GROUP BY COALESCE(l.grp, r.lid), COALESCE(l.id, r.lid), l.attr
);
----
0

# ============================================================
# STRESS TESTS
# ============================================================

# ============================================================
# Test: Both tables empty initially
# ============================================================

statement ok
CREATE TABLE empty_l (id INT, grp VARCHAR);

statement ok
CREATE TABLE empty_r (id INT, lid INT, val INT);

statement ok
CREATE MATERIALIZED VIEW mv_empty AS
    SELECT l.grp, SUM(r.val) AS total, COUNT(r.val) AS cnt
    FROM empty_l l FULL OUTER JOIN empty_r r ON l.id = r.lid
    GROUP BY l.grp;

query I
SELECT COUNT(*) FROM (
    SELECT l.grp, SUM(r.val), COUNT(r.val) FROM empty_l l FULL OUTER JOIN empty_r r ON l.id = r.lid GROUP BY l.grp
    EXCEPT ALL SELECT * FROM mv_empty
);
----
0

# Insert into right only (all unmatched-right, NULL group)
statement ok
INSERT INTO empty_r VALUES (1, 10, 100), (2, 20, 200);

statement ok
PRAGMA refresh('mv_empty');

query I
SELECT COUNT(*) FROM (
    SELECT l.grp, SUM(r.val), COUNT(r.val) FROM empty_l l FULL OUTER JOIN empty_r r ON l.id = r.lid GROUP BY l.grp
    EXCEPT ALL SELECT * FROM mv_empty
);
----
0

query I
SELECT COUNT(*) FROM (
    SELECT * FROM mv_empty EXCEPT ALL
    SELECT l.grp, SUM(r.val), COUNT(r.val) FROM empty_l l FULL OUTER JOIN empty_r r ON l.id = r.lid GROUP BY l.grp
);
----
0

# Insert into left, some matching right
statement ok
INSERT INTO empty_l VALUES (10, 'X'), (30, 'Y');

statement ok
PRAGMA refresh('mv_empty');

query I
SELECT COUNT(*) FROM (
    SELECT l.grp, SUM(r.val), COUNT(r.val) FROM empty_l l FULL OUTER JOIN empty_r r ON l.id = r.lid GROUP BY l.grp
    EXCEPT ALL SELECT * FROM mv_empty
);
----
0

query I
SELECT COUNT(*) FROM (
    SELECT * FROM mv_empty EXCEPT ALL
    SELECT l.grp, SUM(r.val), COUNT(r.val) FROM empty_l l FULL OUTER JOIN empty_r r ON l.id = r.lid GROUP BY l.grp
);
----
0

# ============================================================
# Test: NULL join keys (never match in equijoin)
# ============================================================

statement ok
CREATE TABLE nullk_l (id INT, grp VARCHAR);

statement ok
CREATE TABLE nullk_r (id INT, lid INT, val INT);

statement ok
INSERT INTO nullk_l VALUES (1, 'A'), (NULL, 'NULLKEY');

statement ok
INSERT INTO nullk_r VALUES (1, 1, 50), (2, NULL, 75);

statement ok
CREATE MATERIALIZED VIEW mv_nullkeys AS
    SELECT l.grp, SUM(r.val) AS total, COUNT(r.val) AS cnt
    FROM nullk_l l FULL OUTER JOIN nullk_r r ON l.id = r.lid
    GROUP BY l.grp;

query I
SELECT COUNT(*) FROM (
    SELECT l.grp, SUM(r.val), COUNT(r.val) FROM nullk_l l FULL OUTER JOIN nullk_r r ON l.id = r.lid GROUP BY l.grp
    EXCEPT ALL SELECT * FROM mv_nullkeys
);
----
0

# Insert another NULL-keyed row on each side
statement ok
INSERT INTO nullk_l VALUES (NULL, 'NULLKEY2');

statement ok
INSERT INTO nullk_r VALUES (3, NULL, 125);

statement ok
PRAGMA refresh('mv_nullkeys');

query I
SELECT COUNT(*) FROM (
    SELECT l.grp, SUM(r.val), COUNT(r.val) FROM nullk_l l FULL OUTER JOIN nullk_r r ON l.id = r.lid GROUP BY l.grp
    EXCEPT ALL SELECT * FROM mv_nullkeys
);
----
0

query I
SELECT COUNT(*) FROM (
    SELECT * FROM mv_nullkeys EXCEPT ALL
    SELECT l.grp, SUM(r.val), COUNT(r.val) FROM nullk_l l FULL OUTER JOIN nullk_r r ON l.id = r.lid GROUP BY l.grp
);
----
0

# ============================================================
# Test: Insert then delete same row before refresh (cancels out)
# ============================================================

statement ok
CREATE TABLE cancel_l (id INT, grp VARCHAR);

statement ok
CREATE TABLE cancel_r (id INT, lid INT, val INT);

statement ok
INSERT INTO cancel_l VALUES (1, 'A'), (2, 'B');

statement ok
INSERT INTO cancel_r VALUES (1, 1, 100);

statement ok
CREATE MATERIALIZED VIEW mv_cancel AS
    SELECT l.grp, SUM(r.val) AS total, COUNT(r.val) AS cnt
    FROM cancel_l l FULL OUTER JOIN cancel_r r ON l.id = r.lid
    GROUP BY l.grp;

# Insert and delete same row before refresh — should be no-op
statement ok
INSERT INTO cancel_r VALUES (2, 2, 500);

statement ok
DELETE FROM cancel_r WHERE id = 2;

statement ok
PRAGMA refresh('mv_cancel');

query I
SELECT COUNT(*) FROM (
    SELECT l.grp, SUM(r.val), COUNT(r.val) FROM cancel_l l FULL OUTER JOIN cancel_r r ON l.id = r.lid GROUP BY l.grp
    EXCEPT ALL SELECT * FROM mv_cancel
);
----
0

query I
SELECT COUNT(*) FROM (
    SELECT * FROM mv_cancel EXCEPT ALL
    SELECT l.grp, SUM(r.val), COUNT(r.val) FROM cancel_l l FULL OUTER JOIN cancel_r r ON l.id = r.lid GROUP BY l.grp
);
----
0

# Insert and delete on left side too — cancel out
statement ok
INSERT INTO cancel_l VALUES (5, 'E');

statement ok
DELETE FROM cancel_l WHERE id = 5;

statement ok
PRAGMA refresh('mv_cancel');

query I
SELECT COUNT(*) FROM (
    SELECT l.grp, SUM(r.val), COUNT(r.val) FROM cancel_l l FULL OUTER JOIN cancel_r r ON l.id = r.lid GROUP BY l.grp
    EXCEPT ALL SELECT * FROM mv_cancel
);
----
0

query I
SELECT COUNT(*) FROM (
    SELECT * FROM mv_cancel EXCEPT ALL
    SELECT l.grp, SUM(r.val), COUNT(r.val) FROM cancel_l l FULL OUTER JOIN cancel_r r ON l.id = r.lid GROUP BY l.grp
);
----
0

# ============================================================
# Test: All 8 transitions in a single refresh
# {insert,delete} × {left,right} × {matched,unmatched}
# ============================================================

statement ok
CREATE TABLE trans_l (id INT, grp VARCHAR);

statement ok
CREATE TABLE trans_r (id INT, lid INT, val INT);

statement ok
INSERT INTO trans_l VALUES (1, 'A'), (2, 'B'), (3, 'C'), (4, 'D');

statement ok
INSERT INTO trans_r VALUES (1, 1, 10), (2, 2, 20), (3, 50, 30), (4, 60, 40);

statement ok
CREATE MATERIALIZED VIEW mv_trans AS
    SELECT l.grp, SUM(r.val) AS total, COUNT(r.val) AS cnt
    FROM trans_l l FULL OUTER JOIN trans_r r ON l.id = r.lid
    GROUP BY l.grp;

# 1. INSERT LEFT MATCHED: insert left id=50, matches right lid=50
# 2. INSERT LEFT UNMATCHED: insert left id=99, no right match
# 3. DELETE LEFT MATCHED: delete left id=1, right lid=1 becomes unmatched
# 4. DELETE LEFT UNMATCHED: delete left id=3, was unmatched-left
# 5. INSERT RIGHT MATCHED: insert right lid=2, adds to B
# 6. INSERT RIGHT UNMATCHED: insert right lid=200, no left match
# 7. DELETE RIGHT MATCHED: delete right lid=2 (id=2), B loses its match
# 8. DELETE RIGHT UNMATCHED: delete right lid=60 (id=4), shrinks NULL group
statement ok
INSERT INTO trans_l VALUES (50, 'E');

statement ok
INSERT INTO trans_l VALUES (99, 'Z');

statement ok
DELETE FROM trans_l WHERE id = 1;

statement ok
DELETE FROM trans_l WHERE id = 3;

statement ok
INSERT INTO trans_r VALUES (5, 2, 25);

statement ok
INSERT INTO trans_r VALUES (6, 200, 60);

statement ok
DELETE FROM trans_r WHERE id = 2;

statement ok
DELETE FROM trans_r WHERE id = 4;

statement ok
PRAGMA refresh('mv_trans');

query I
SELECT COUNT(*) FROM (
    SELECT l.grp, SUM(r.val), COUNT(r.val) FROM trans_l l FULL OUTER JOIN trans_r r ON l.id = r.lid GROUP BY l.grp
    EXCEPT ALL SELECT * FROM mv_trans
);
----
0

query I
SELECT COUNT(*) FROM (
    SELECT * FROM mv_trans EXCEPT ALL
    SELECT l.grp, SUM(r.val), COUNT(r.val) FROM trans_l l FULL OUTER JOIN trans_r r ON l.id = r.lid GROUP BY l.grp
);
----
0

# ============================================================
# Test: Large batch with many conflicting INSERT+DELETE
# ============================================================

statement ok
CREATE TABLE batch_l (id INT, grp VARCHAR);

statement ok
CREATE TABLE batch_r (id INT, lid INT, val INT);

statement ok
INSERT INTO batch_l VALUES (1, 'A'), (2, 'B'), (3, 'C'), (4, 'D'), (5, 'E');

statement ok
INSERT INTO batch_r VALUES (1, 1, 10), (2, 1, 20), (3, 2, 30), (4, 6, 40), (5, 7, 50);

statement ok
CREATE MATERIALIZED VIEW mv_batch AS
    SELECT l.grp, SUM(r.val) AS total, COUNT(r.val) AS cnt
    FROM batch_l l FULL OUTER JOIN batch_r r ON l.id = r.lid
    GROUP BY l.grp;

# Batch: many conflicting ops
statement ok
DELETE FROM batch_r WHERE lid = 1;

statement ok
INSERT INTO batch_r VALUES (6, 3, 60), (7, 4, 70);

statement ok
DELETE FROM batch_l WHERE id = 2;

statement ok
INSERT INTO batch_l VALUES (6, 'F');

statement ok
INSERT INTO batch_r VALUES (8, 99, 80), (9, 100, 90);

statement ok
INSERT INTO batch_r VALUES (10, 5, 999);

statement ok
DELETE FROM batch_r WHERE id = 10;

statement ok
DELETE FROM batch_r WHERE id = 5;

statement ok
INSERT INTO batch_r VALUES (11, 7, 500);

statement ok
PRAGMA refresh('mv_batch');

query I
SELECT COUNT(*) FROM (
    SELECT l.grp, SUM(r.val), COUNT(r.val) FROM batch_l l FULL OUTER JOIN batch_r r ON l.id = r.lid GROUP BY l.grp
    EXCEPT ALL SELECT * FROM mv_batch
);
----
0

query I
SELECT COUNT(*) FROM (
    SELECT * FROM mv_batch EXCEPT ALL
    SELECT l.grp, SUM(r.val), COUNT(r.val) FROM batch_l l FULL OUTER JOIN batch_r r ON l.id = r.lid GROUP BY l.grp
);
----
0

# Second batch
statement ok
INSERT INTO batch_l VALUES (7, 'G'), (100, 'H');

statement ok
DELETE FROM batch_l WHERE id = 3;

statement ok
INSERT INTO batch_r VALUES (12, 1, 15), (13, 1, 25);

statement ok
DELETE FROM batch_r WHERE lid = 4;

statement ok
DELETE FROM batch_l WHERE id = 6;

statement ok
INSERT INTO batch_r VALUES (14, 5, 55);

statement ok
PRAGMA refresh('mv_batch');

query I
SELECT COUNT(*) FROM (
    SELECT l.grp, SUM(r.val), COUNT(r.val) FROM batch_l l FULL OUTER JOIN batch_r r ON l.id = r.lid GROUP BY l.grp
    EXCEPT ALL SELECT * FROM mv_batch
);
----
0

query I
SELECT COUNT(*) FROM (
    SELECT * FROM mv_batch EXCEPT ALL
    SELECT l.grp, SUM(r.val), COUNT(r.val) FROM batch_l l FULL OUTER JOIN batch_r r ON l.id = r.lid GROUP BY l.grp
);
----
0

# ============================================================
# Test: Simultaneous same-key inserts in both deltas
# ============================================================

statement ok
CREATE TABLE simul_l (id INT, grp VARCHAR);

statement ok
CREATE TABLE simul_r (id INT, lid INT, val INT);

statement ok
INSERT INTO simul_l VALUES (1, 'A');

statement ok
INSERT INTO simul_r VALUES (1, 1, 50);

statement ok
CREATE MATERIALIZED VIEW mv_simul AS
    SELECT l.grp, SUM(r.val) AS total, COUNT(r.val) AS cnt
    FROM simul_l l FULL OUTER JOIN simul_r r ON l.id = r.lid
    GROUP BY l.grp;

# Both sides insert with same join key simultaneously
statement ok
INSERT INTO simul_l VALUES (10, 'NEW');

statement ok
INSERT INTO simul_r VALUES (2, 10, 200), (3, 10, 300);

statement ok
PRAGMA refresh('mv_simul');

query I
SELECT COUNT(*) FROM (
    SELECT l.grp, SUM(r.val), COUNT(r.val) FROM simul_l l FULL OUTER JOIN simul_r r ON l.id = r.lid GROUP BY l.grp
    EXCEPT ALL SELECT * FROM mv_simul
);
----
0

query I
SELECT COUNT(*) FROM (
    SELECT * FROM mv_simul EXCEPT ALL
    SELECT l.grp, SUM(r.val), COUNT(r.val) FROM simul_l l FULL OUTER JOIN simul_r r ON l.id = r.lid GROUP BY l.grp
);
----
0

# Both sides delete with same join key simultaneously
statement ok
DELETE FROM simul_l WHERE id = 10;

statement ok
DELETE FROM simul_r WHERE lid = 10;

statement ok
PRAGMA refresh('mv_simul');

query I
SELECT COUNT(*) FROM (
    SELECT l.grp, SUM(r.val), COUNT(r.val) FROM simul_l l FULL OUTER JOIN simul_r r ON l.id = r.lid GROUP BY l.grp
    EXCEPT ALL SELECT * FROM mv_simul
);
----
0

query I
SELECT COUNT(*) FROM (
    SELECT * FROM mv_simul EXCEPT ALL
    SELECT l.grp, SUM(r.val), COUNT(r.val) FROM simul_l l FULL OUTER JOIN simul_r r ON l.id = r.lid GROUP BY l.grp
);
----
0

# ============================================================
# Test: Multiple aggregates (SUM + COUNT + AVG)
# ============================================================

statement ok
CREATE TABLE multi_l (id INT, grp VARCHAR);

statement ok
CREATE TABLE multi_r (id INT, lid INT, val INT);

statement ok
INSERT INTO multi_l VALUES (1, 'A'), (2, 'B'), (3, 'C');

statement ok
INSERT INTO multi_r VALUES (1, 1, 100), (2, 1, 200), (3, 5, 300);

statement ok
CREATE MATERIALIZED VIEW mv_multi_agg AS
    SELECT l.grp, SUM(r.val) AS total, COUNT(r.val) AS cnt, AVG(r.val) AS avg_val
    FROM multi_l l FULL OUTER JOIN multi_r r ON l.id = r.lid
    GROUP BY l.grp;

query I
SELECT COUNT(*) FROM (
    SELECT l.grp, SUM(r.val), COUNT(r.val), AVG(r.val) FROM multi_l l FULL OUTER JOIN multi_r r ON l.id = r.lid GROUP BY l.grp
    EXCEPT ALL SELECT * FROM mv_multi_agg
);
----
0

statement ok
INSERT INTO multi_r VALUES (4, 2, 150);

statement ok
INSERT INTO multi_r VALUES (5, 99, 400);

statement ok
DELETE FROM multi_r WHERE lid = 1;

statement ok
INSERT INTO multi_l VALUES (5, 'D');

statement ok
PRAGMA refresh('mv_multi_agg');

query I
SELECT COUNT(*) FROM (
    SELECT l.grp, SUM(r.val), COUNT(r.val), AVG(r.val) FROM multi_l l FULL OUTER JOIN multi_r r ON l.id = r.lid GROUP BY l.grp
    EXCEPT ALL SELECT * FROM mv_multi_agg
);
----
0

query I
SELECT COUNT(*) FROM (
    SELECT * FROM mv_multi_agg EXCEPT ALL
    SELECT l.grp, SUM(r.val), COUNT(r.val), AVG(r.val) FROM multi_l l FULL OUTER JOIN multi_r r ON l.id = r.lid GROUP BY l.grp
);
----
0

# ============================================================
# Regression: FULL OUTER hidden right key through projection/filter stack
# ============================================================

statement ok
CREATE TABLE chain_foj_left_src (id INT, totaln INT, districts INT);

statement ok
CREATE TABLE chain_foj_right_src (id INT, total_orders INT, order_avg DOUBLE);

statement ok
INSERT INTO chain_foj_left_src VALUES (1, 20, 2), (2, 7, 1), (4, 11, 3);

statement ok
INSERT INTO chain_foj_right_src VALUES (1, 12, 2.5), (3, 5, 1.5), (4, 20, 0.5);

statement ok
CREATE MATERIALIZED VIEW mv_chain_foj_left AS
    SELECT id AS C_W_ID, totaln, districts FROM chain_foj_left_src WHERE totaln > 0;

statement ok
CREATE MATERIALIZED VIEW mv_chain_foj_right AS
    SELECT id AS w_id, total_orders, order_avg FROM chain_foj_right_src;

statement ok
CREATE MATERIALIZED VIEW mv_chain_foj_cross AS
    WITH a AS (SELECT * FROM mv_chain_foj_left),
         b AS (SELECT * FROM mv_chain_foj_right),
         combined AS (
             SELECT COALESCE(a.C_W_ID, b.w_id) AS w_id,
                    a.totaln AS cust_totaln,
                    a.districts AS cust_districts,
                    b.total_orders AS order_lines,
                    b.order_avg AS order_avg
             FROM a FULL OUTER JOIN b ON a.C_W_ID = b.w_id
         )
    SELECT w_id, cust_totaln, cust_districts, order_lines, order_avg,
           CASE WHEN cust_totaln IS NULL THEN 'order-only'
                WHEN order_lines IS NULL THEN 'cust-only'
                WHEN cust_totaln > 0 AND order_avg > 1 THEN 'active'
                ELSE 'dormant' END AS status
    FROM combined
    WHERE cust_totaln IS NOT NULL OR order_lines IS NOT NULL;

query I
SELECT COUNT(*) FROM (
    (SELECT w_id, cust_totaln, cust_districts, order_lines, order_avg, status FROM mv_chain_foj_cross)
    EXCEPT ALL
    (WITH a AS (SELECT id AS C_W_ID, totaln, districts FROM chain_foj_left_src WHERE totaln > 0),
         b AS (SELECT id AS w_id, total_orders, order_avg FROM chain_foj_right_src),
         combined AS (
             SELECT COALESCE(a.C_W_ID, b.w_id) AS w_id,
                    a.totaln AS cust_totaln,
                    a.districts AS cust_districts,
                    b.total_orders AS order_lines,
                    b.order_avg AS order_avg
             FROM a FULL OUTER JOIN b ON a.C_W_ID = b.w_id
         )
    SELECT w_id, cust_totaln, cust_districts, order_lines, order_avg,
           CASE WHEN cust_totaln IS NULL THEN 'order-only'
                WHEN order_lines IS NULL THEN 'cust-only'
                WHEN cust_totaln > 0 AND order_avg > 1 THEN 'active'
                ELSE 'dormant' END AS status
    FROM combined
    WHERE cust_totaln IS NOT NULL OR order_lines IS NOT NULL)
);
----
0

query I
SELECT COUNT(*) FROM (
    (WITH a AS (SELECT id AS C_W_ID, totaln, districts FROM chain_foj_left_src WHERE totaln > 0),
         b AS (SELECT id AS w_id, total_orders, order_avg FROM chain_foj_right_src),
         combined AS (
             SELECT COALESCE(a.C_W_ID, b.w_id) AS w_id,
                    a.totaln AS cust_totaln,
                    a.districts AS cust_districts,
                    b.total_orders AS order_lines,
                    b.order_avg AS order_avg
             FROM a FULL OUTER JOIN b ON a.C_W_ID = b.w_id
         )
    SELECT w_id, cust_totaln, cust_districts, order_lines, order_avg,
           CASE WHEN cust_totaln IS NULL THEN 'order-only'
                WHEN order_lines IS NULL THEN 'cust-only'
                WHEN cust_totaln > 0 AND order_avg > 1 THEN 'active'
                ELSE 'dormant' END AS status
    FROM combined
    WHERE cust_totaln IS NOT NULL OR order_lines IS NOT NULL)
    EXCEPT ALL
    (SELECT w_id, cust_totaln, cust_districts, order_lines, order_avg, status FROM mv_chain_foj_cross)
);
----
0

statement ok
INSERT INTO chain_foj_right_src VALUES (2, 14, 3.0);

statement ok
DELETE FROM chain_foj_left_src WHERE id = 1;

statement ok
INSERT INTO chain_foj_left_src VALUES (3, 9, 2);

statement ok
PRAGMA refresh('mv_chain_foj_left');

statement ok
PRAGMA refresh('mv_chain_foj_right');

statement ok
PRAGMA refresh('mv_chain_foj_cross');

query I
SELECT COUNT(*) FROM (
    (SELECT w_id, cust_totaln, cust_districts, order_lines, order_avg, status FROM mv_chain_foj_cross)
    EXCEPT ALL
    (WITH a AS (SELECT id AS C_W_ID, totaln, districts FROM chain_foj_left_src WHERE totaln > 0),
         b AS (SELECT id AS w_id, total_orders, order_avg FROM chain_foj_right_src),
         combined AS (
             SELECT COALESCE(a.C_W_ID, b.w_id) AS w_id,
                    a.totaln AS cust_totaln,
                    a.districts AS cust_districts,
                    b.total_orders AS order_lines,
                    b.order_avg AS order_avg
             FROM a FULL OUTER JOIN b ON a.C_W_ID = b.w_id
         )
    SELECT w_id, cust_totaln, cust_districts, order_lines, order_avg,
           CASE WHEN cust_totaln IS NULL THEN 'order-only'
                WHEN order_lines IS NULL THEN 'cust-only'
                WHEN cust_totaln > 0 AND order_avg > 1 THEN 'active'
                ELSE 'dormant' END AS status
    FROM combined
    WHERE cust_totaln IS NOT NULL OR order_lines IS NOT NULL)
);
----
0

query I
SELECT COUNT(*) FROM (
    (WITH a AS (SELECT id AS C_W_ID, totaln, districts FROM chain_foj_left_src WHERE totaln > 0),
         b AS (SELECT id AS w_id, total_orders, order_avg FROM chain_foj_right_src),
         combined AS (
             SELECT COALESCE(a.C_W_ID, b.w_id) AS w_id,
                    a.totaln AS cust_totaln,
                    a.districts AS cust_districts,
                    b.total_orders AS order_lines,
                    b.order_avg AS order_avg
             FROM a FULL OUTER JOIN b ON a.C_W_ID = b.w_id
         )
    SELECT w_id, cust_totaln, cust_districts, order_lines, order_avg,
           CASE WHEN cust_totaln IS NULL THEN 'order-only'
                WHEN order_lines IS NULL THEN 'cust-only'
                WHEN cust_totaln > 0 AND order_avg > 1 THEN 'active'
                ELSE 'dormant' END AS status
    FROM combined
    WHERE cust_totaln IS NOT NULL OR order_lines IS NOT NULL)
    EXCEPT ALL
    (SELECT w_id, cust_totaln, cust_districts, order_lines, order_avg, status FROM mv_chain_foj_cross)
);
----
0
