# name: test/sql/list.test
# description: Test IVM with LIST-typed aggregate columns
# group: [sql]

require openivm

# --- Base table with LIST<FLOAT> column ---
statement ok
CREATE TABLE items (id INT, grp INT, val FLOAT[]);

statement ok
INSERT INTO items VALUES
    (1, 1, list_transform(generate_series(1, 64), lambda x: 10.0::FLOAT)),
    (2, 1, list_transform(generate_series(1, 64), lambda x: 20.0::FLOAT)),
    (3, 2, list_transform(generate_series(1, 64), lambda x: 30.0::FLOAT));

# --- MV: element-wise list sum using pure DuckDB ---
statement ok
CREATE MATERIALIZED VIEW mv_list AS (
    SELECT grp,
        list_reduce(list(val), lambda a, b: list_transform(list_zip(a, b), lambda x: x[1] + x[2])) AS total
    FROM items GROUP BY grp
);

# Verify initial state
query I
SELECT COUNT(*) FROM (
    SELECT * FROM mv_list
    EXCEPT ALL
    SELECT grp, list_reduce(list(val), lambda a, b: list_transform(list_zip(a, b), lambda x: x[1] + x[2])) AS total
    FROM items GROUP BY grp
);
----
0

query I
SELECT COUNT(*) FROM (
    SELECT grp, list_reduce(list(val), lambda a, b: list_transform(list_zip(a, b), lambda x: x[1] + x[2])) AS total
    FROM items GROUP BY grp
    EXCEPT ALL
    SELECT * FROM mv_list
);
----
0

# ==========================================
# LIST aggregate with FILTER must not retain NULLs
# ==========================================

statement ok
CREATE TABLE list_filter_items (grp INT, item INT, qty INT);

statement ok
INSERT INTO list_filter_items VALUES
    (1, 10, 90), (1, 20, 10), (1, 30, 80),
    (2, 40, 20), (2, 50, 70);

statement ok
CREATE MATERIALIZED VIEW mv_list_filter AS
    SELECT grp, LIST(item ORDER BY qty DESC) FILTER (WHERE qty > 50) AS well_stocked
    FROM list_filter_items GROUP BY grp;

query I
SELECT type FROM openivm_views WHERE view_name = 'mv_list_filter';
----
6

statement ok
INSERT INTO list_filter_items VALUES (1, 60, 95), (2, 70, 30);

statement ok
pragma refresh('mv_list_filter');

query I
SELECT COUNT(*) FROM (
    SELECT * FROM mv_list_filter
    EXCEPT ALL
    SELECT grp, LIST(item ORDER BY qty DESC) FILTER (WHERE qty > 50) AS well_stocked
    FROM list_filter_items GROUP BY grp
);
----
0

query I
SELECT COUNT(*) FROM (
    SELECT grp, LIST(item ORDER BY qty DESC) FILTER (WHERE qty > 50) AS well_stocked
    FROM list_filter_items GROUP BY grp
    EXCEPT ALL
    SELECT * FROM mv_list_filter
);
----
0

# LIST FILTER fallback with top-level HAVING must relax affected keys even when
# the stored query falls back to the original SQL.
statement ok
CREATE TABLE list_filter_having_items (grp INT, item INT, qty INT);

statement ok
INSERT INTO list_filter_having_items VALUES
    (1, 10, 90),
    (2, 20, 80), (2, 30, 40);

statement ok
CREATE MATERIALIZED VIEW mv_list_filter_having AS
    SELECT grp, LIST(item ORDER BY qty DESC) FILTER (WHERE qty > 50) AS well_stocked
    FROM list_filter_having_items GROUP BY grp
    HAVING COUNT(*) > 1;

query I
SELECT type FROM openivm_views WHERE view_name = 'mv_list_filter_having';
----
6

query T
SELECT group_recompute_affected_mode FROM openivm_views WHERE view_name = 'mv_list_filter_having';
----
source_delta_relax_aggregate_filter

query I
SELECT COUNT(*) FROM (
    SELECT * FROM mv_list_filter_having
    EXCEPT ALL
    SELECT grp, LIST(item ORDER BY qty DESC) FILTER (WHERE qty > 50)
    FROM list_filter_having_items GROUP BY grp
    HAVING COUNT(*) > 1
);
----
0

query I
SELECT COUNT(*) FROM (
    SELECT grp, LIST(item ORDER BY qty DESC) FILTER (WHERE qty > 50)
    FROM list_filter_having_items GROUP BY grp
    HAVING COUNT(*) > 1
    EXCEPT ALL
    SELECT * FROM mv_list_filter_having
);
----
0

statement ok
INSERT INTO list_filter_having_items VALUES (1, 40, 70), (2, 50, 60);

statement ok
DELETE FROM list_filter_having_items WHERE grp = 2 AND item = 30;

statement ok
UPDATE list_filter_having_items SET qty = 65 WHERE grp = 2 AND item = 20;

statement ok
PRAGMA refresh('mv_list_filter_having');

query I
SELECT COUNT(*) FROM (
    SELECT * FROM mv_list_filter_having
    EXCEPT ALL
    SELECT grp, LIST(item ORDER BY qty DESC) FILTER (WHERE qty > 50)
    FROM list_filter_having_items GROUP BY grp
    HAVING COUNT(*) > 1
);
----
0

query I
SELECT COUNT(*) FROM (
    SELECT grp, LIST(item ORDER BY qty DESC) FILTER (WHERE qty > 50)
    FROM list_filter_having_items GROUP BY grp
    HAVING COUNT(*) > 1
    EXCEPT ALL
    SELECT * FROM mv_list_filter_having
);
----
0

# Retained ORDER BY/LIMIT fallback must use current-vs-stored affected keys.
# The unchanged second-place group has to enter the LIMIT after the old top group
# loses rows, even though that second-place group has no delta.
statement ok
CREATE TABLE list_filter_topk_items (grp INT, item INT, qty INT);

statement ok
INSERT INTO list_filter_topk_items VALUES
    (1, 10, 90), (1, 11, 80), (1, 12, 70),
    (2, 20, 85), (2, 21, 75),
    (3, 30, 95);

statement ok
CREATE MATERIALIZED VIEW mv_list_filter_topk AS
    SELECT grp,
           LIST(item ORDER BY qty DESC) FILTER (WHERE qty > 50) AS well_stocked,
           COUNT(*) AS cnt
    FROM list_filter_topk_items
    GROUP BY grp
    HAVING COUNT(*) > 0
    ORDER BY cnt DESC, grp
    LIMIT 1;

query I
SELECT type FROM openivm_views WHERE view_name = 'mv_list_filter_topk';
----
6

query T
SELECT group_recompute_affected_mode FROM openivm_views WHERE view_name = 'mv_list_filter_topk';
----
current_diff

query I
WITH expected AS (
    SELECT grp,
           LIST(item ORDER BY qty DESC) FILTER (WHERE qty > 50) AS well_stocked,
           COUNT(*) AS cnt
    FROM list_filter_topk_items
    GROUP BY grp
    HAVING COUNT(*) > 0
    ORDER BY cnt DESC, grp
    LIMIT 1
)
SELECT COUNT(*) FROM (
    SELECT * FROM mv_list_filter_topk
    EXCEPT ALL
    SELECT * FROM expected
);
----
0

query I
WITH expected AS (
    SELECT grp,
           LIST(item ORDER BY qty DESC) FILTER (WHERE qty > 50) AS well_stocked,
           COUNT(*) AS cnt
    FROM list_filter_topk_items
    GROUP BY grp
    HAVING COUNT(*) > 0
    ORDER BY cnt DESC, grp
    LIMIT 1
)
SELECT COUNT(*) FROM (
    SELECT * FROM expected
    EXCEPT ALL
    SELECT * FROM mv_list_filter_topk
);
----
0

statement ok
DELETE FROM list_filter_topk_items WHERE grp = 1 AND item IN (10, 11);

statement ok
INSERT INTO list_filter_topk_items VALUES (3, 31, 65);

statement ok
PRAGMA refresh('mv_list_filter_topk');

query I
WITH expected AS (
    SELECT grp,
           LIST(item ORDER BY qty DESC) FILTER (WHERE qty > 50) AS well_stocked,
           COUNT(*) AS cnt
    FROM list_filter_topk_items
    GROUP BY grp
    HAVING COUNT(*) > 0
    ORDER BY cnt DESC, grp
    LIMIT 1
)
SELECT COUNT(*) FROM (
    SELECT * FROM mv_list_filter_topk
    EXCEPT ALL
    SELECT * FROM expected
);
----
0

query I
WITH expected AS (
    SELECT grp,
           LIST(item ORDER BY qty DESC) FILTER (WHERE qty > 50) AS well_stocked,
           COUNT(*) AS cnt
    FROM list_filter_topk_items
    GROUP BY grp
    HAVING COUNT(*) > 0
    ORDER BY cnt DESC, grp
    LIMIT 1
)
SELECT COUNT(*) FROM (
    SELECT * FROM expected
    EXCEPT ALL
    SELECT * FROM mv_list_filter_topk
);
----
0

# Fallback top-k views store the already-limited original query in the data table,
# but the user-facing view still needs ORDER BY. This catches stale physical order
# after only the second group changes.
statement ok
CREATE TABLE list_filter_order_items (grp INT, item INT, qty INT);

statement ok
INSERT INTO list_filter_order_items VALUES
    (1, 10, 90), (1, 11, 80), (1, 12, 70),
    (2, 20, 85), (2, 21, 75),
    (3, 30, 95);

statement ok
CREATE MATERIALIZED VIEW mv_list_filter_order AS
    SELECT grp,
           LIST(item ORDER BY qty DESC) FILTER (WHERE qty > 50) AS well_stocked,
           COUNT(*) AS cnt
    FROM list_filter_order_items
    GROUP BY grp
    HAVING COUNT(*) > 0
    ORDER BY cnt DESC, grp DESC
    LIMIT 2;

query I
SELECT grp FROM mv_list_filter_order;
----
1
2

statement ok
INSERT INTO list_filter_order_items VALUES (2, 22, 65);

statement ok
UPDATE list_filter_order_items SET qty = 96 WHERE grp = 3 AND item = 30;

statement ok
DELETE FROM list_filter_order_items WHERE grp = 3 AND item = 30;

statement ok
PRAGMA refresh('mv_list_filter_order');

query I
SELECT grp FROM mv_list_filter_order;
----
2
1

query I
WITH expected AS (
    SELECT grp,
           LIST(item ORDER BY qty DESC) FILTER (WHERE qty > 50) AS well_stocked,
           COUNT(*) AS cnt
    FROM list_filter_order_items
    GROUP BY grp
    HAVING COUNT(*) > 0
    ORDER BY cnt DESC, grp DESC
    LIMIT 2
)
SELECT COUNT(*) FROM (
    SELECT * FROM mv_list_filter_order
    EXCEPT ALL
    SELECT * FROM expected
);
----
0

query I
WITH expected AS (
    SELECT grp,
           LIST(item ORDER BY qty DESC) FILTER (WHERE qty > 50) AS well_stocked,
           COUNT(*) AS cnt
    FROM list_filter_order_items
    GROUP BY grp
    HAVING COUNT(*) > 0
    ORDER BY cnt DESC, grp DESC
    LIMIT 2
)
SELECT COUNT(*) FROM (
    SELECT * FROM expected
    EXCEPT ALL
    SELECT * FROM mv_list_filter_order
);
----
0

# LIST FILTER fallback with hidden AVG columns must create the MV delta table
# from the actual data table schema so downstream refresh snapshots bind.
statement ok
CREATE TABLE list_filter_avg_items (grp INT, item INT, qty INT, price DOUBLE);

statement ok
INSERT INTO list_filter_avg_items VALUES
    (1, 10, 90, 12.0), (1, 20, 10, 20.0), (1, 30, 80, 18.0),
    (2, 40, 20,  9.0), (2, 50, 70, 15.0);

statement ok
CREATE MATERIALIZED VIEW mv_list_filter_avg_parent AS
    SELECT grp,
           AVG(price) AS avg_price,
           LIST(item ORDER BY qty DESC) FILTER (WHERE qty > 50) AS well_stocked
    FROM list_filter_avg_items GROUP BY grp;

statement ok
CREATE MATERIALIZED VIEW mv_list_filter_avg_child AS
    SELECT grp, avg_price FROM mv_list_filter_avg_parent WHERE avg_price > 10;

statement ok
INSERT INTO list_filter_avg_items VALUES
    (1, 60, 95, 30.0),
    (2, 70, 75, 21.0);

statement ok
DELETE FROM list_filter_avg_items WHERE grp = 1 AND item = 20;

statement ok
PRAGMA refresh('mv_list_filter_avg_parent');

statement ok
PRAGMA refresh('mv_list_filter_avg_child');

query I
SELECT COUNT(*) FROM (
    SELECT * FROM mv_list_filter_avg_parent
    EXCEPT ALL
    SELECT grp,
           AVG(price) AS avg_price,
           LIST(item ORDER BY qty DESC) FILTER (WHERE qty > 50) AS well_stocked
    FROM list_filter_avg_items GROUP BY grp
);
----
0

query I
SELECT COUNT(*) FROM (
    SELECT grp,
           AVG(price) AS avg_price,
           LIST(item ORDER BY qty DESC) FILTER (WHERE qty > 50) AS well_stocked
    FROM list_filter_avg_items GROUP BY grp
    EXCEPT ALL
    SELECT * FROM mv_list_filter_avg_parent
);
----
0

# Delta-schema derivation failures on the LPTS fallback path must clean up the
# data table and user view that were already created before schema derivation.
statement ok
CREATE TABLE list_schema_cleanup_items (grp INT, item INT, qty INT, price DOUBLE);

statement ok
INSERT INTO list_schema_cleanup_items VALUES
    (1, 10, 90, 12.0), (1, 20, 10, 20.0), (1, 30, 80, 18.0),
    (2, 40, 20,  9.0), (2, 50, 70, 15.0);

statement error
CREATE MATERIALIZED VIEW mv_list_schema_cleanup AS
    SELECT grp,
           AVG(price) AS openivm_multiplicity,
           LIST(item ORDER BY qty DESC) FILTER (WHERE qty > 50) AS well_stocked
    FROM list_schema_cleanup_items GROUP BY grp;
----
reserved OpenIVM column

query I
SELECT COUNT(*) FROM information_schema.tables
WHERE table_name IN (
    'mv_list_schema_cleanup',
    'openivm_data_mv_list_schema_cleanup',
    'openivm_delta_mv_list_schema_cleanup'
);
----
0

statement ok
CREATE MATERIALIZED VIEW mv_list_schema_cleanup AS
    SELECT grp,
           AVG(price) AS avg_price,
           LIST(item ORDER BY qty DESC) FILTER (WHERE qty > 50) AS well_stocked
    FROM list_schema_cleanup_items GROUP BY grp;

statement ok
INSERT INTO list_schema_cleanup_items VALUES (2, 60, 95, 30.0);

statement ok
PRAGMA refresh('mv_list_schema_cleanup');

query I
SELECT COUNT(*) FROM (
    SELECT * FROM mv_list_schema_cleanup
    EXCEPT ALL
    SELECT grp,
           AVG(price) AS avg_price,
           LIST(item ORDER BY qty DESC) FILTER (WHERE qty > 50) AS well_stocked
    FROM list_schema_cleanup_items GROUP BY grp
);
----
0

query I
SELECT COUNT(*) FROM (
    SELECT grp,
           AVG(price) AS avg_price,
           LIST(item ORDER BY qty DESC) FILTER (WHERE qty > 50) AS well_stocked
    FROM list_schema_cleanup_items GROUP BY grp
    EXCEPT ALL
    SELECT * FROM mv_list_schema_cleanup
);
----
0

query I
SELECT COUNT(*) FROM (
    SELECT * FROM mv_list_filter_avg_child
    EXCEPT ALL
    SELECT grp, avg_price FROM (
        SELECT grp,
               AVG(price) AS avg_price,
               LIST(item ORDER BY qty DESC) FILTER (WHERE qty > 50) AS well_stocked
        FROM list_filter_avg_items GROUP BY grp
    ) expected WHERE avg_price > 10
);
----
0

query I
SELECT COUNT(*) FROM (
    SELECT grp, avg_price FROM (
        SELECT grp,
               AVG(price) AS avg_price,
               LIST(item ORDER BY qty DESC) FILTER (WHERE qty > 50) AS well_stocked
        FROM list_filter_avg_items GROUP BY grp
    ) expected WHERE avg_price > 10
    EXCEPT ALL
    SELECT * FROM mv_list_filter_avg_child
);
----
0

# ==========================================
# 1. Insert into existing group
# ==========================================

statement ok
INSERT INTO items VALUES (4, 2, list_transform(generate_series(1, 64), lambda x: 40.0::FLOAT));

statement ok
pragma refresh('mv_list');

query I
SELECT COUNT(*) FROM (
    SELECT * FROM mv_list
    EXCEPT ALL
    SELECT grp, list_reduce(list(val), lambda a, b: list_transform(list_zip(a, b), lambda x: x[1] + x[2])) AS total
    FROM items GROUP BY grp
);
----
0

query I
SELECT COUNT(*) FROM (
    SELECT grp, list_reduce(list(val), lambda a, b: list_transform(list_zip(a, b), lambda x: x[1] + x[2])) AS total
    FROM items GROUP BY grp
    EXCEPT ALL
    SELECT * FROM mv_list
);
----
0

# ==========================================
# 2. Insert new group
# ==========================================

statement ok
INSERT INTO items VALUES (5, 3, list_transform(generate_series(1, 64), lambda x: 50.0::FLOAT));

statement ok
pragma refresh('mv_list');

query I
SELECT COUNT(*) FROM (
    SELECT * FROM mv_list
    EXCEPT ALL
    SELECT grp, list_reduce(list(val), lambda a, b: list_transform(list_zip(a, b), lambda x: x[1] + x[2])) AS total
    FROM items GROUP BY grp
);
----
0

query I
SELECT COUNT(*) FROM (
    SELECT grp, list_reduce(list(val), lambda a, b: list_transform(list_zip(a, b), lambda x: x[1] + x[2])) AS total
    FROM items GROUP BY grp
    EXCEPT ALL
    SELECT * FROM mv_list
);
----
0

# ==========================================
# 3. Delete from existing group
# ==========================================

statement ok
DELETE FROM items WHERE id = 1;

statement ok
pragma refresh('mv_list');

query I
SELECT COUNT(*) FROM (
    SELECT * FROM mv_list
    EXCEPT ALL
    SELECT grp, list_reduce(list(val), lambda a, b: list_transform(list_zip(a, b), lambda x: x[1] + x[2])) AS total
    FROM items GROUP BY grp
);
----
0

query I
SELECT COUNT(*) FROM (
    SELECT grp, list_reduce(list(val), lambda a, b: list_transform(list_zip(a, b), lambda x: x[1] + x[2])) AS total
    FROM items GROUP BY grp
    EXCEPT ALL
    SELECT * FROM mv_list
);
----
0

# ==========================================
# 4. Mixed insert + delete in same batch
# ==========================================

statement ok
INSERT INTO items VALUES (6, 1, list_transform(generate_series(1, 64), lambda x: 100.0::FLOAT));

statement ok
DELETE FROM items WHERE id = 2;

statement ok
pragma refresh('mv_list');

query I
SELECT COUNT(*) FROM (
    SELECT * FROM mv_list
    EXCEPT ALL
    SELECT grp, list_reduce(list(val), lambda a, b: list_transform(list_zip(a, b), lambda x: x[1] + x[2])) AS total
    FROM items GROUP BY grp
);
----
0

query I
SELECT COUNT(*) FROM (
    SELECT grp, list_reduce(list(val), lambda a, b: list_transform(list_zip(a, b), lambda x: x[1] + x[2])) AS total
    FROM items GROUP BY grp
    EXCEPT ALL
    SELECT * FROM mv_list
);
----
0

# ==========================================
# 5. No-op pragma
# ==========================================

statement ok
pragma refresh('mv_list');

query I
SELECT COUNT(*) FROM (
    SELECT * FROM mv_list
    EXCEPT ALL
    SELECT grp, list_reduce(list(val), lambda a, b: list_transform(list_zip(a, b), lambda x: x[1] + x[2])) AS total
    FROM items GROUP BY grp
);
----
0

query I
SELECT COUNT(*) FROM (
    SELECT grp, list_reduce(list(val), lambda a, b: list_transform(list_zip(a, b), lambda x: x[1] + x[2])) AS total
    FROM items GROUP BY grp
    EXCEPT ALL
    SELECT * FROM mv_list
);
----
0
