# name: test/sql/spark_add_months.test
# description: Spark-compatible add_months scalar function (correctness + incremental MV maintenance)
# group: [sql]

require openivm

statement ok
SET openivm_files_path='__TEST_DIR__';

# --- Direct scalar correctness (Spark add_months semantics) ---

# Month-end input -> target month-end (with clamp)
query I
SELECT add_months(DATE '2015-01-31', 1) = DATE '2015-02-28';
----
true

# Non month-end input, day clamps to target month length
query I
SELECT add_months(DATE '2015-01-30', 1) = DATE '2015-02-28';
----
true

# Non month-end input, day fits
query I
SELECT add_months(DATE '2015-01-28', 1) = DATE '2015-02-28';
----
true

# Leap-year target month-end
query I
SELECT add_months(DATE '2016-01-31', 1) = DATE '2016-02-29';
----
true

# Feb month-end (non-leap) -> March month-end
query I
SELECT add_months(DATE '2015-02-28', 1) = DATE '2015-03-31';
----
true

# Leap Feb month-end -> non-leap Feb month-end across a year
query I
SELECT add_months(DATE '2016-02-29', 12) = DATE '2017-02-28';
----
true

# Negative months, month-end preserved
query I
SELECT add_months(DATE '2015-03-31', -1) = DATE '2015-02-28';
----
true

# Year rollover, day preserved
query I
SELECT add_months(DATE '2015-01-15', 13) = DATE '2016-02-15';
----
true

# December month-end -> January month-end (year rollover)
query I
SELECT add_months(DATE '2015-12-31', 1) = DATE '2016-01-31';
----
true

# NULL propagation
query I
SELECT add_months(NULL::DATE, 1) IS NULL;
----
true

# --- Incremental materialized-view maintenance using add_months ---

statement ok
CREATE TABLE am_item (id INT, d DATE, n INT);

statement ok
INSERT INTO am_item VALUES
    (1, DATE '2015-01-31', 1),
    (2, DATE '2016-02-29', 12),
    (3, DATE '2015-01-15', 13);

statement ok
CREATE MATERIALIZED VIEW am_mv AS
    SELECT id, d, n, add_months(d, n) AS shifted
    FROM am_item;

statement ok
SELECT COUNT(*) FROM openivm_compile_with_facts(
    'am_mv',
    '{"target_dialect":"duckdb","compile_only":true}'
);

# Real SIMPLE_PROJECTION delta emitted (no full-refresh demotion)
query I
SELECT CASE
           WHEN contains(content, 'INSERT INTO openivm_delta_am_mv') AND
                contains(content, 'openivm_delta_am_item') AND
                NOT contains(content, 'SELECT NULL::')
           THEN 1 ELSE 0
       END
FROM read_text('__TEST_DIR__/openivm_upsert_queries_am_mv.sql');
----
1

statement ok
UPDATE am_item SET d = DATE '2015-12-31', n = 1 WHERE id = 1;

statement ok
INSERT INTO am_item VALUES (4, DATE '2015-06-30', 3);

statement ok
DELETE FROM am_item WHERE id = 3;

statement ok
PRAGMA refresh('am_mv');

# Incrementally maintained MV matches full recomputation, both directions
query I
SELECT COUNT(*) FROM (
    SELECT * FROM am_mv
    EXCEPT ALL
    SELECT id, d, n, add_months(d, n) AS shifted FROM am_item
);
----
0

query I
SELECT COUNT(*) FROM (
    SELECT id, d, n, add_months(d, n) AS shifted FROM am_item
    EXCEPT ALL
    SELECT * FROM am_mv
);
----
0
