# name: test/sql/window_running_aggregate_daily_market_window_over_window.test
# description: Running-window suffix refresh handles the TPC-DI daily_market window-over-window shape.
# group: [sql]

require openivm

statement ok
SET openivm_files_path='__TEST_DIR__';

statement ok
SET openivm_running_window_incremental=true;

statement ok
CREATE TABLE brokerage_daily_market (
    dm_date DATE,
    dm_s_symb VARCHAR,
    dm_close INT,
    dm_high INT,
    dm_low INT,
    dm_vol INT
);

statement ok
INSERT INTO brokerage_daily_market VALUES
    (DATE '2024-01-01', 'AAA', 101, 20, 10, 1000),
    (DATE '2024-01-02', 'AAA', 102, 22, 8, 1100),
    (DATE '2024-01-01', 'BBB', 201, 30, 15, 2000),
    (DATE '2024-01-02', 'BBB', 202, 29, 16, 2100);

statement ok
CREATE MATERIALIZED VIEW wradwow_mv AS
WITH cumulative AS (
  SELECT dm_date, dm_s_symb, dm_close, dm_high, dm_low, dm_vol,
         min(dm_low)  OVER w AS fifty_two_week_low,
         max(dm_high) OVER w AS fifty_two_week_high
  FROM brokerage_daily_market
  WINDOW w AS (PARTITION BY dm_s_symb ORDER BY dm_date)
), flagged AS (
  SELECT *,
         CASE WHEN dm_low  = fifty_two_week_low  THEN dm_date ELSE NULL END AS low_date_flag,
         CASE WHEN dm_high = fifty_two_week_high THEN dm_date ELSE NULL END AS high_date_flag
  FROM cumulative
)
SELECT dm_date, dm_s_symb, dm_close, dm_high, dm_low, dm_vol,
       fifty_two_week_low, fifty_two_week_high,
       max(low_date_flag)  OVER (PARTITION BY dm_s_symb ORDER BY dm_date) AS fifty_two_week_low_date,
       max(high_date_flag) OVER (PARTITION BY dm_s_symb ORDER BY dm_date) AS fifty_two_week_high_date
FROM flagged;

statement ok
INSERT INTO brokerage_daily_market VALUES
    (DATE '2024-01-03', 'AAA', 103, 24, 7, 1200),
    (DATE '2024-01-03', 'BBB', 203, 31, 14, 2200),
    (DATE '2024-01-01', 'CCC', 301, 40, 25, 3000);

query I
WITH compiled AS (
    SELECT stmt_order, sql
    FROM openivm_compile_with_facts(
        'wradwow_mv',
        '{"target_dialect":"duckdb","compile_only":true,"assume_insert_only":true,"running_window_incremental":true}'
    )
    WHERE stmt_kind = 'data'
), program AS (
    SELECT string_agg(sql, ' ' ORDER BY stmt_order) AS sql FROM compiled
), fast_insert AS (
    SELECT sql FROM compiled WHERE sql LIKE 'INSERT INTO openivm_data_wradwow_mv (%'
)
SELECT CASE WHEN (SELECT sql FROM program) LIKE '%openivm_run_fast_wradwow_mv%'
         AND (SELECT sql FROM program) LIKE '%openivm_aux_run_state_wradwow_mv%'
         AND (SELECT sql FROM program) NOT LIKE '%FROM openivm_data_wradwow_mv dt JOIN openivm_run_fast_wradwow_mv%'
         AND (SELECT sql FROM fast_insert) LIKE '%openivm_l1 AS%'
         AND (SELECT sql FROM fast_insert) LIKE '%MIN(d.dm_low)%'
         AND (SELECT sql FROM fast_insert) LIKE '%MAX(d.dm_high)%'
         AND (SELECT sql FROM fast_insert) LIKE '%CASE WHEN (dm_low) = (fifty_two_week_low) THEN dm_date ELSE CAST(NULL AS DATE) END%'
         AND (SELECT sql FROM fast_insert) LIKE '%CASE WHEN (dm_high) = (fifty_two_week_high) THEN dm_date ELSE CAST(NULL AS DATE) END%'
         AND (SELECT sql FROM fast_insert) LIKE '%MAX(f.t10_low_date_flag)%'
         AND (SELECT sql FROM fast_insert) LIKE '%MAX(f.t10_high_date_flag)%'
    THEN 1 ELSE 0 END;
----
1

statement ok
PRAGMA refresh('wradwow_mv');

query I
WITH expected AS (
    WITH cumulative AS (
      SELECT dm_date, dm_s_symb, dm_close, dm_high, dm_low, dm_vol,
             min(dm_low)  OVER w AS fifty_two_week_low,
             max(dm_high) OVER w AS fifty_two_week_high
      FROM brokerage_daily_market
      WINDOW w AS (PARTITION BY dm_s_symb ORDER BY dm_date)
    ), flagged AS (
      SELECT *,
             CASE WHEN dm_low  = fifty_two_week_low  THEN dm_date ELSE NULL END AS low_date_flag,
             CASE WHEN dm_high = fifty_two_week_high THEN dm_date ELSE NULL END AS high_date_flag
      FROM cumulative
    )
    SELECT dm_date, dm_s_symb, dm_close, dm_high, dm_low, dm_vol,
           fifty_two_week_low, fifty_two_week_high,
           max(low_date_flag)  OVER (PARTITION BY dm_s_symb ORDER BY dm_date) AS fifty_two_week_low_date,
           max(high_date_flag) OVER (PARTITION BY dm_s_symb ORDER BY dm_date) AS fifty_two_week_high_date
    FROM flagged
)
SELECT COUNT(*) FROM (
    SELECT * FROM openivm_data_wradwow_mv
    EXCEPT ALL
    SELECT * FROM expected
);
----
0

query I
WITH expected AS (
    WITH cumulative AS (
      SELECT dm_date, dm_s_symb, dm_close, dm_high, dm_low, dm_vol,
             min(dm_low)  OVER w AS fifty_two_week_low,
             max(dm_high) OVER w AS fifty_two_week_high
      FROM brokerage_daily_market
      WINDOW w AS (PARTITION BY dm_s_symb ORDER BY dm_date)
    ), flagged AS (
      SELECT *,
             CASE WHEN dm_low  = fifty_two_week_low  THEN dm_date ELSE NULL END AS low_date_flag,
             CASE WHEN dm_high = fifty_two_week_high THEN dm_date ELSE NULL END AS high_date_flag
      FROM cumulative
    )
    SELECT dm_date, dm_s_symb, dm_close, dm_high, dm_low, dm_vol,
           fifty_two_week_low, fifty_two_week_high,
           max(low_date_flag)  OVER (PARTITION BY dm_s_symb ORDER BY dm_date) AS fifty_two_week_low_date,
           max(high_date_flag) OVER (PARTITION BY dm_s_symb ORDER BY dm_date) AS fifty_two_week_high_date
    FROM flagged
)
SELECT COUNT(*) FROM (
    SELECT * FROM expected
    EXCEPT ALL
    SELECT * FROM openivm_data_wradwow_mv
);
----
0

statement ok
INSERT INTO brokerage_daily_market VALUES
    (DATE '2024-01-01', 'AAA', 99, 25, 6, 900),
    (DATE '2024-01-04', 'BBB', 204, 32, 13, 2300),
    (DATE '2024-01-01', 'DDD', 401, 50, 35, 4000);

statement ok
DELETE FROM brokerage_daily_market
WHERE dm_s_symb = 'CCC' AND dm_date = DATE '2024-01-01';

statement ok
PRAGMA refresh('wradwow_mv');

query I
WITH expected AS (
    WITH cumulative AS (
      SELECT dm_date, dm_s_symb, dm_close, dm_high, dm_low, dm_vol,
             min(dm_low)  OVER w AS fifty_two_week_low,
             max(dm_high) OVER w AS fifty_two_week_high
      FROM brokerage_daily_market
      WINDOW w AS (PARTITION BY dm_s_symb ORDER BY dm_date)
    ), flagged AS (
      SELECT *,
             CASE WHEN dm_low  = fifty_two_week_low  THEN dm_date ELSE NULL END AS low_date_flag,
             CASE WHEN dm_high = fifty_two_week_high THEN dm_date ELSE NULL END AS high_date_flag
      FROM cumulative
    )
    SELECT dm_date, dm_s_symb, dm_close, dm_high, dm_low, dm_vol,
           fifty_two_week_low, fifty_two_week_high,
           max(low_date_flag)  OVER (PARTITION BY dm_s_symb ORDER BY dm_date) AS fifty_two_week_low_date,
           max(high_date_flag) OVER (PARTITION BY dm_s_symb ORDER BY dm_date) AS fifty_two_week_high_date
    FROM flagged
)
SELECT COUNT(*) FROM (
    SELECT * FROM openivm_data_wradwow_mv
    EXCEPT ALL
    SELECT * FROM expected
);
----
0

query I
WITH expected AS (
    WITH cumulative AS (
      SELECT dm_date, dm_s_symb, dm_close, dm_high, dm_low, dm_vol,
             min(dm_low)  OVER w AS fifty_two_week_low,
             max(dm_high) OVER w AS fifty_two_week_high
      FROM brokerage_daily_market
      WINDOW w AS (PARTITION BY dm_s_symb ORDER BY dm_date)
    ), flagged AS (
      SELECT *,
             CASE WHEN dm_low  = fifty_two_week_low  THEN dm_date ELSE NULL END AS low_date_flag,
             CASE WHEN dm_high = fifty_two_week_high THEN dm_date ELSE NULL END AS high_date_flag
      FROM cumulative
    )
    SELECT dm_date, dm_s_symb, dm_close, dm_high, dm_low, dm_vol,
           fifty_two_week_low, fifty_two_week_high,
           max(low_date_flag)  OVER (PARTITION BY dm_s_symb ORDER BY dm_date) AS fifty_two_week_low_date,
           max(high_date_flag) OVER (PARTITION BY dm_s_symb ORDER BY dm_date) AS fifty_two_week_high_date
    FROM flagged
)
SELECT COUNT(*) FROM (
    SELECT * FROM expected
    EXCEPT ALL
    SELECT * FROM openivm_data_wradwow_mv
);
----
0
